username,comment,time,likes,reply_count
@roopnarayan1479,"рдкреНрд░рд╢реНрди. 4. рд╡рд┐рдЪрд╛рд░рд┐рдП рддреЛ, рдХреНрдпрд╛ рд╢рд╛рди рдЖрдкрдХреА рдЗрд╕ рджреЗрд╢ рдореЗрдВ рдереА рдФрд░ рдЕрдм рдХреНрдпрд╛ рд╣реЛ рдЧрдИ! рдХрд┐рддрдиреЗ рдКрдБрдЪреЗ рд╣реЛрдХрд░ рдЖрдк рдХрд┐рддрдиреЗ рдиреАрдЪреЗ рдЧрд┐рд░реЗред тАУ рдЖрд╢рдп рд╕реНрдкрд╖реНрдЯ рдХреАрдЬрд┐рдПред рдЙрддреНрддрд░: рдпрд╣ рдХрдерди рд▓реЗрдЦрдХ рджреНрд╡рд╛рд░рд╛ рд▓рд╛рд░реНрдб рдХрд░реНрдЬрди рдХреЛ рд╕рдВрдмреЛрдзрд┐рдд рдХрд░рддреЗ рд╣реБрдП рдХрд╣рд╛ рдЧрдпрд╛ рд╣реИред рдЙрд╕ рд╕рдордп рдЬрдмрдХрд┐ рдХреМрдВрд╕рд┐рд▓ рдореЗрдВ рдордирдкрд╕рдВрдж рд╕рджрд╕реНрдпреЛрдВ рдХреА рдирд┐рдпреБрдХреНрддрд┐ рдХрд░рд╡рд╛рдиреЗ рдХреЗ рдореБрджреНрджреЗ рдкрд░ рд▓реЙрд░реНрдб рдХреЛ рдЕрдкрдорд╛рдирд┐рдд рд╣реЛрдирд╛ рдкрдбрд╝рд╛ рдерд╛, рд▓реЗрдЦрдХ рдпрд╛рдж рджрд┐рд▓рд╛ рд░рд╣реЗ рд╣реИрдВ рдХрд┐ рдЖрдкрдХреЛ рднрд╛рд░рдд рдореЗрдВ рдмрд╛рджрд╢рд╛рд╣ рдХреЗ рдмрд░рд╛рдмрд░ рд╕реЛрдиреЗ рдХреА рдХреБрд░рд╕реА рдорд┐рд▓реА, рдЖрдкрдХреЛ рд╕рдмрд╕реЗ рдКрдБрдЪрд╛ рдУрд╣рджрд╛ рдорд┐рд▓рд╛ред рдЖрдкрдХреА рд╕рд╡рд╛рд░реА рд╕рдмрд╕реЗ рдКрдБрдЪреА рдирд┐рдХрд▓рддреА рдереА рдФрд░ рдХреИрд╕реА рд╡рд┐рдбрдВрдмрдирд╛ рд╣реИ рдХрд┐ рдЖрдЬ рдЖрдк рди рдЗрдВрдЧреНрд▓реИрдВрдб рдореЗрдВ рдорд╛рди рдкрд╛ рд╕рдХреЗ, рди рд╣реА рднрд╛рд░рдд рдореЗрдВ рдЙрд╕ рдкрдж рдкрд░ рд░рд╣ рд╕рдХреЗред рдХрд╣рдиреЗ рдХрд╛ рддрд╛рддреНрдкрд░реНрдп рдпрд╣ рд╣реИ рдХрд┐ рдЬрд┐рдирдХрд╛ рд╣реБрдХреНрдо рдмрдЬрд╛рдиреЗ рдХреЗ рд▓рд┐рдП рдЖрдк рднрд╛рд░рддреАрдп рдЬрдирддрд╛ рдХрд╛ рд╢реЛрд╖рдг рдХрд░рддреЗ рд░рд╣реЗ, рдЖрдЬ рдЙрдиреНрд╣реЛрдВрдиреЗ рд╣реА рдЖрдкрдХреЛ рдареБрдХрд░рд╛ рджрд┐рдпрд╛ред рдЖрдкрдХрд╛ рдорд╛рди-рд╕рдореНрдорд╛рди рд╕рдм рдорд┐рдЯреНрдЯреА рдореЗрдВ рдорд┐рд▓ рдЧрдпрд╛ред рд▓реЗрдЦрдХ рдЪрд╛рд╣рддрд╛ рд╣реИ рдХрд┐ рдХрд░реНрдЬрди рд╕реЛрдЪрдХрд░ рджреЗрдЦреЗ рдХрд┐ рдЕрдХрд╛рд░рдг рд╣рдорд╛рд░реЗ рд╣рд┐рддреЛрдВ рдХреЛ рдХреБрдЪрд▓рдХрд░ рд╣рдорд╛рд░реЗ рджреЗрд╢ рдХреЛ рдХрд╛рдЯрдХрд░ рдЖрдЬ рдЙрд╕реЗ рдХреНрдпрд╛ рд╣рд╛рд╕рд┐рд▓ рд╣реБрдЖ?  рдкреНрд░рд╢реНрди. 5.",6ьЛЬъ░Д ьаД,0,
@elijahgodwintz01,.,2ьг╝ ьаД,0,
@wadmaka,Where's Story Of Israel !!? ЁЯШЕ Don't say shut up ЁЯШЕ .. a big hypocrisy in history..ЁЯШЕ,3ьг╝ ьаД,0,
@ffbdgamingyt1085,Bangladesh тЭдтЭд i am proud of my motherland,1ъ░ЬьЫФ ьаД,0,
@eg_tasin,"Sometimes I wonder why the guidance of extraordinary minds like Gowher Rizvi and Dr. Kamal Hossain faded away. Why were we deprived of their advice and critique? I do know, though, the toxic political environment in Bangladesh made it so. We prioritized ground-level heat to secure power over academic knowledge to lead real change.",2ъ░ЬьЫФ ьаД,0,
@SirBeauJangles,"ItтАЩs like SO kind of Google to allow slivers of Oxford speaking between their highly welcome advertisings which we all love like SO much and come here especially to view.  There was a whole MINUTE and a bit of a second before the first ad break came through.  So very generous of The Incredibly Public Spirited Google to let about 70 whole uninterrupted SECONDS before the  first commercial break arrivedтАж Re their advertisers.  People are like SO critical about the standard of items advertised here on YTube, yet I remember well seeing an advertisement here about nine months ago that was only slightly suspect, meaning that only about 99.9% of ads here are crooked cheating bastards, so - WTF???  People are just so disrespectfully critical of GoogleтАЩs тАЬstandardsтАЭ - which is like SO unfair, when Google has clearly tried so hard to change this platform to one entirely FREE of the slavery of observing standards of - whatтАЩs that word again? - gottit. тАЬQuality.тАЭ Standards of Quality - who needs such outmoded and imperfectly-commercial concepts? Not us! WeтАЩre- Googlers, and proud to be free of standards of ANY sort! Just like - Republicans!",3ъ░ЬьЫФ ьаД,0,
@thermal84,Why is this your best video lmao,4ъ░ЬьЫФ ьаД,2,
@TimeржУрзЯрж╛рж░рзНржЪрзЬрзАржг,swbadhin indipindente the father of the nasashon,6ъ░ЬьЫФ ьаД,0,
@TimeржУрзЯрж╛рж░рзНржЪрзЬрзАржг,work its who,6ъ░ЬьЫФ ьаД,0,
@TimeржУрзЯрж╛рж░рзНржЪрзЬрзАржг,chukher jol amar dore rakgte parna karon bujte parina ami hasina ke valobasina kinwthu take dekhle cukger jol cole ase eken cukh amar karon ki,6ъ░ЬьЫФ ьаД,0,
@montasinuddinsami1234,Proud Bangladeshi from Britain.,8ъ░ЬьЫФ ьаД,0,
@mahimulIslamrimon,Who is watching from 2025ЁЯШо,8ъ░ЬьЫФ ьаД,2,
@biorig,"Visiting back after a year, so much has changed now. And I feel sorry for the future of Bangladesh.  Its society is getting radicalised so fast that their might not be a return to secular liberal democratic principles it was founded upon.",9ъ░ЬьЫФ ьаД,11,
@liamballaugh3629,"26 OCTOBER-MASSIVE RALLY IN LONDON- TOMMY ROBINSON- DR. JAY SMITH - HIS ANCIENT MAPS,SCRIPTS AND TEXTS,PROVE ISLAM MAN- MADE RELIGION SAM SHAMOUN- ENCYCLOPEDIC KNOWLEDGE OF THE KORAN-DEBATES IMAMS DAILY- SHOWING KORAN IS FULL OF FLAWS,LIES- CREATED BY A MAN OF LOW INTELLIGENCE- THEY BOTH HAVE EXCELLENT YOUTUBE CHANNELS- FIND OUT WHY KORAN ENCOURAGES EVIL- ( MOHAMED BEGAN HAVING SEX WOTH HIS WIFE- AT AGE 9- WITH MOHAMEDS BLESSING)...",11ъ░ЬьЫФ ьаД,1,
@RayanSayeem,Bangladesh тЭдтЭд,11ъ░ЬьЫФ ьаД,1,
@authenticallysuperficial9874,Here after the 2024 revolution,1ыЕД ьаД,1,
@engrshahriarrahmantalukdar7959,thank you Oxford union for give respect to our assets Dr Kamal Hossain,1ыЕД ьаД,1,
@saeedkhan483,Being a proud Pakistani ЁЯЗ╡ЁЯЗ░ alot of love for Bangladesh,1ыЕД ьаД,9,
@MamunAkando-w2w,Day by day Bangladesh has been developing comparatively to other countries. Congratulations Bangladesh go ahead.12-07-2024 from ЁЯЗзЁЯЗйЁЯЗзЁЯЗйЁЯЗзЁЯЗйЁЯеАтЭдя╕П,1ыЕД ьаД(ьИШьаХыРи),0,
@iamalihussain0,I don't know why this video is the most viewed on this channel. I am really curious about it.,1ыЕД ьаД,1,
@ThienNguyen-ef2kg,Bangladeshis click / engagement farms. 9 years ago was a golden age for these type of service.,3ьг╝ ьаД,0,
@montasinuddinsami1234,Me,8ъ░ЬьЫФ ьаД,0,
@Ftsyygijbkjnutd6,"I would suggest you to watch actual scholars of Islam who not only spent years researching Islam but also know other religions well. Zakir naik, Mohammed hijab, one message foundation and plenty others will be helpful.  Lastly the Quran doesnтАЩt encourage anything of what you said. Such marriages were very common back then and it was deemed acceptable.",11ъ░ЬьЫФ ьаД,2,
@mdzillurrahman4261,тЭдтЭдтЭдтЭдтЭдтЭдтЭдтЭдтЭдтЭдтЭдтЭдтЭдтЭдтЭдтЭдтЭдтЭдтЭдтЭдтЭдтЭдтЭдтЭдтЭдтЭдтЭдтЭдтЭдтЭдтЭдтЭд,1ыЕД ьаД,0,
@raparlajayakrishna9278,Creative Money Language  sdfghh 233445667788.99  thousound lack crore (I own personal each mal├й or Female or newbron Kids mal├й or Female,1ыЕД ьаД,0,
@raparlajayakrishna9278,"I own bank deposite no Money currency id ,Many face Blance nill",1ыЕД ьаД,0,
@raparlajayakrishna9278,"many n├бme bank or symbol or atm ,I own personal Life Money currency",1ыЕД ьаД,0,
@raparlajayakrishna9278,one country peper one face Money currency (Long distance visible),1ыЕД ьаД,0,
@raparlajayakrishna9278,haiways Road Side Wirte Money currency boads,1ыЕД ьаД,0,
@raparlajayakrishna9278,"Road Side Wirte Money currency boads, I own personal",1ыЕД ьаД,0,
@raparlajayakrishna9278,"I am raparla Jaya krishna, I own personal Life, (General People call owner, labor,  Agricultural Village",1ыЕД ьаД,0,
@raparlajayakrishna9278,I own personal Life,1ыЕД ьаД,0,
@raparlajayakrishna9278,Creative,1ыЕД ьаД,0,
@raparlajayakrishna9278,"Independence, republic",1ыЕД ьаД,0,
@raparlajayakrishna9278,"1947,1940,1971",1ыЕД ьаД,0,
@adibajannat334,Waow it was surprising while i saw the tittle....discussion about myyyy Bengal! Well m definitely gonna download  n watch it.  Hope to see you Oxford in there  one day inshallah ЁЯЩМ,1ыЕД ьаД(ьИШьаХыРи),0,
@mdzillurrahman4261,тЭдтЭдтЭдтЭдтЭдтЭд,1ыЕД ьаД,0,
@atrikroy9160,Bangladesh is a quasi Islamic state  radical Islamist mindset still appeal to a huge number of population,1ыЕД ьаД,0,
@rishi.girdhar,"Its good to see the rise of the Bangladesh economically, their  GDP speaks a lot about their policies and hard work but it has few grey areas which needs to be addressed religious extremism and persecution of minorities.",1ыЕД ьаД,0,
@rajanisuphari,"Bangladesh atleast didn't end up like poxtan ЁЯШВЁЯШВЁЯШВ, happy for that.",1ыЕД ьаД,1,
@workhardt2,ЁЯЗжЁЯЗкЁЯЗжЁЯЗкЁЯЗжЁЯЗкЁЯЗжЁЯЗкЁЯШе,1ыЕД ьаД,1,
@yousify1379,Oh Shapiro don't worry all the world now know that Israel is a war criminal,1ыЕД ьаД,1,
@chriscockrell9495,How this has 18M views seems rather suspect to me.,1ыЕД ьаД,4,
@raparlajayakrishna9278,"Road write Money currency boads, name of bank or symbol or atm Road Side Money Board",1ыЕД ьаД,0,
@raparlajayakrishna9278,I own personal,1ыЕД ьаД,0,
@raparlajayakrishna9278,Reference My name,1ыЕД ьаД,0,
@dynamitrix1006,india should address their extremism and persecution of minorities too,1ыЕД ьаД,1,
@rishi.girdhar,┬а@dynamitrix1006┬а What do you smoke and what do you read?,1ыЕД ьаД,0,
@king_911,"It's inevitable, it will never go away, no matter which country, even the most peaceful countries either have a dark past or run by countries with a dark past, because of religion, politics whatever it may be. The fallen ones will rise and risen ones will fall. No country was, is or will be in perfect peace.",1ыЕД ьаД,0,
@clansey1973,This is a brilliant introspection of the Bangladeshi real-politic.   We could do with a similar debate about PR in the context of Britain!   Bengali subtitles may further enhance this broadcast!?,1ыЕД ьаД,4,
@gauravsoni4019,Dr Hussain you are great. Love from India.,2ыЕД ьаД,5,
@lifearttimes,Shine On!тЬитЬитЬи,2ыЕД ьаД,3,
@duckbizniz663,"Bangladesh is concerned with global warming. Again we see the fabrication of a fake problem, global warming. What is it? All the data claiming global warming is made up by left-wing extremists who have no background in science and are wilingl to make up false information to make a fake claim. Considering the under-development of Bangladesh, compared to industrialized countries, it cannot afford to waste its resources and efforts on nonsense. The industrialized countries are spending a limited amount of resources to appease the delusions of environmental extremists. Third world countries do not have excess resources to expend on the lunatic fringe. Why are some countries under developed while other countries are industrialized and can provided a higher standard of living to its people. Because the industrialized countries know what is a real problem and to ignore imaginary problems.",2ыЕД ьаД,1,
@duckbizniz663,"Really appreciate this Oxford Union discussion on Bangladesh. Almost all of the speakers mentioned something about Bangladesh's struggle to secure independence from the evil Pakistanis. Dr. Kamal Hussein mentions how the East Pakistan tried to impose an official religion, i.e. Islam, on West Pakistan (Bangladesh) when Bangladeshi's wanted a secular state. Let us not forget that at the end of WWII the British Empire could no longer afford to hold onto its largest colony of the Indian Subcontinent. When the British proposed to give the Indian Subcontinent its independence, the Hindus and the Muslims immediately started to fight over how to divide up the Indian Subcontinent. The Hindus wanted one country for the Indian Subcontinent, while the Muslims wanted their own separate country from the Hindus and other religious groups. So the British government created Pakistan for the Muslims where current Pakistan was East Pakistan and Bangladesh was West Pakistan. Pakistan was split by India in the middle. Most Hindus moved to India. There were horrendous mass killings between Hindus and Muslims during this mass migration. The Pakistani central government was based in East Pakistan. At some point, West Pakistan became disgruntled and fought for independence. When East Pakistan send their military to defeat West Pakistani Independence movement the Indian Hindus decided to send its military into West Pakistan to help defeat East Pakistani military, and secure independence for Bangladesh. Bangladesh was able to secure its independence and create a secular government with no official religion. Except according to Dr. Gowher Rizvi Bangladesh Constitution does have a clause acknowledging Islam as the religion for the vast majority of its people. So this separation of God and State is not absolute like the US or France. From what I have read the reason India helped Bangladesh fight for independence is due to the fact that Muslims created a separate state from the Hindus of India. Bangladesh wanted independence not because it wanted a secular state. Bangladeshis felt that East Pakistan government was ignoring West Pakistanis' rights. Again from most BBC documentaries its seems Bangladeshis were not worried about creating a secular state, but resented East Pakistan's rule over West Pakistan or Bangladesh.",2ыЕД ьаД,0,
@duckbizniz663,"It is good to see academic institutions like Oxford helping third-world countries like Bangladesh in developing its society. I had been traveling in India and Pakistan in 2016. My travel guides in India and Pakistan had informed me that while Pakistan and India are far behind the developed countries in Western Europe, Bangladesh is miserably behind India and Pakistan. As a result, I have to conclude that there is very little or practically no development in Bangladesh when compared to the under-developed countries of India and Pakistan. it is also disturbing that the host of Oxford Union would make up a lie about the average age of death in Bangladesh has exceeded the average age of death in India. Denigrating India to make Bangladesh look good is counterproductive. I have also noticed that most of the speakers praise government policies and NGOs (disturbing how people invent words that have no basis in reality) for implementing the correct programs that improve the lives of the average Bangladesh citizens. When we look at the development of Western Europe and the US, it is private citizens working in their own professions, creating new machines and new services, and establishing profitable businesses that have significantly raised the standard of living of their own people. Yes, the governments of Western Europe and the US enacted laws (or policies) that help promote trade and industrialization, which helped all businesses to compete, but it is the private citizens themselves who made the most significant contribution to the development of their society. What the 4 speakers are advocating is a socialist-communist approach to economic development or trade development. We know that this type of centralized 5 to 10 year planning or top-down command economies do not work. Sir Paul Collier brings up an excellent point. While Saudi Arabia had fossil fuel, i.e. petroleum, to sell and make an incredible amount of money. Most agrarian countries are not blessed with a raw resource that fuel the industrialized trading system of developed countries (Western Europe, the US, Canada, Japan, & South Korea). So these third-world countries must progress through the difficult process of changing their society and use the ingenuity of its people to industrialized just like Western Europe, the US, Canada, Japan, and South Korea. Clearly, Saudi Arabia and most of the oil producing countries of the Arabian Peninsula are living a materially abundant existence, but they have not made any essential changes that would enable them to become a modern, industrialized nation. But in the absence of a profitable resource, Bangladesh must undertake the herculean task of transforming its society into a modern, industrialized, democracy, with a republic form of government, under the rule of law. This is very hard to do. As Dr. Kamal Hussein mentions that garment workers living in slums are having their the houses taken from them by somebody (Dr. Hussein probably means profit seeking housing developers). The underlying problem is Bangladesh, as a ""backward"" country, does not have well defined property law. Many poor people like garment workers simply move onto land and build a house. They did not pay for that land. The government does not keep records of well defined property boundaries. Primitive societies do not keep track of property ownership, which depend on a capitalist system where ownership is protected by the rule of law. The poor garment workers simply took that land as ""squatters"". Now the garment workers or squatters expect the land they took for free to belong to them. There is no clear property ownership in these primitive societies like Bangladesh. So it is easy for socialist-communist like Dr. Kamal Hussein to complain about evil property developers taking land from poor garment workers. The problem is Bangladesh is a primitive society with no rule of clearly defined law. Yet Bangladesh is trying to enter the modern industrialized age. Is that possible? Then Dr. Kamal Hussein goes on rambling about confrontation, consensus, and tolerance. Maybe we should all hold hands and sing kumbaya? Bangladesh is a primitive society where private property is not clearly defined. The government does not even keep track of property boundaries. So what is Dr. Kamal Hussein talking about? Then Dr. Kamal Hussein rambles on about fraudulent votes, buying votes, and how money undermines the democratic process. At least I think that is what he saying. Dr. Kamal Hussein is either a Marxist-Socialist-Communist or he is misguided Muslim. He does not see that getting people to a higher standard of living where they have enough to eat, a decent house, and a DECENT education for themselves & their children is the most important. When people have these things they will not sell their vote. The people elect their government representatives, these representatives make the laws, and individual property rights must be protected. Then people will give their best effort to make the best life for themselves. No, Dr. Kamal Hussein views this type of self-serving greed will undermine democracy. This is the problem of primitive religious interpretation and 19th century Marxism. They do not understand liberalism. Dr. Gowher Rizvi said many positive things about Bangladesh and its political system. These are very encouraging and its shows Bangladeshi's commitment to further development. Dr. Gowher Rizvi also mention that since Bangladesh's independence from its parent Pakistan, the weakness of its democracy is due to the fact that Bangladesh has spent half of its time under military takeover and rule. This challenge is almost identical to the Islamic Republic of Pakistan, Bangladesh's parent country. Bangledesh's achievements should be applauded and encouraged, but Bangladesh have inherited the challenges of the Islamic Republic of Pakistan. In fact, if you look around the world. In the Near-East, Middle-East, Arabian Peninsula, Indonesia, Africa, ... or any country with a strong Islamic tradition you see the military suppressing democratically elected governments with armed military rule. Many under-developed countries, whether Islamic or some other religion, you see military dictatorship burying legitimately elected democratic governments. Why is that? Might makes right, a primitive form of governance since the dawn of humanity, still rule much of the world. Can a society where might makes right still guide the thinking of its people achieve a modern, industrialized democratic republic? I do not think so. I hope Bangladesh will make it.",2ыЕД ьаД,0,
@farhadal-amin2909,ЁЯШК,2ыЕД ьаД,1,
@smmedialondon11,Highest viewed video in the oxford union channel.,2ыЕД ьаД,70,
@salimullah6260,Dr kamak citings pepole of bangladesh  sek hasena s pepole,2ыЕД ьаД,1,
@salimullah6260,ЁЯШВЁЯШВЁЯШВ,2ыЕД ьаД,2,
@educationalpurpose1532,12:38 sending women to work isn't the only thing that makes a country 's economy strong. it's optional.... not necessary...,2ыЕД ьаД,0,
@Anticommunism99,"What Bangladesh? This is India always been India, Islam won't change history or facts.",2ыЕД ьаД,2,
@Anticommunism99,Bangladesh is dirty primitive 3rd world country guess why? Islam,2ыЕД ьаД,1,
@cmjakaria7912,Proud to be Bangladesh community тЭд,2ыЕД ьаД,2,
@rashedurrahmanjaved58,https://youtu.be/puf86ZkmAKE,2ыЕД ьаД,0,
@StGeorge257,"Rotacism,go see a speech therapist!!!",2ыЕД ьаД,0,
@devkaranmeena5036,"Democracy is government of the people, by the people, for the people. If majority of the people who elect the government are stupid and selfish they will get government with misters of such qualities. In a democracy are themselves to be blamed for bad government and nobody else.",2ыЕД ьаД(ьИШьаХыРи),1,
@devkaranmeena5036,"Bangladesh people are ungrateful that despite having been helped by Hindus they are still being persecuted by Muslims. Muslims can never be tolerant to other religions unless the root of it in their scriptures is addressed. If the economic condition of Bangladesh has improved so significantly as per their representative why we donтАЩt see reverse migration of refugees from India. It makes clear that Muslims have larger and unholy desire to change the demography of border states West Bengal, Assam and Jharkhand.",2ыЕД ьаД(ьИШьаХыРи),2,
@InternationalNewsChannel112,Hi I am form Bangladesh ЁЯЗзЁЯЗйтЭдя╕П,2ыЕД ьаД,0,
@shamimhuq2134,Two political parties live in Bangladesh. The dominant  Political party is Awami League with about 46% of the electorate. The opposing party is BNP or Bangladesh National Party with about 33% of the electorate.,2ыЕД ьаД(ьИШьаХыРи),0,
@Ahmedsakil85,India and Bangladesh has different history,2ыЕД ьаД,3,
@Anticommunism99,You are Indian,2ыЕД ьаД,1,
@Anticommunism99,Islam is primitive,2ыЕД ьаД,0,
@realnikolatesla,20:00,2ыЕД ьаД,0,
@Bangla_Bhai,The RED MONKEY in tha middle is a Wonder Hehe,2ыЕД ьаД,0,
@fmbird9159,R koto natok r mittha kotha bolbi today,2ыЕД ьаД,0,
@monirulislamiqra,Just a wonderful discussion.. love from Bangladesh,2ыЕД ьаД,1,
@nbb11nnbb,we cant all have a Jefferson,2ыЕД ьаД,0,
@aladinbd8297,from Bangladesh тШ║я╕П,2ыЕД ьаД,0,
@dacca.,ржкрзГржерж┐ржмрзА рж╕рждрзНржпрзЗрж░ рж╢ржХрзНрждрж┐ ржжрзНржмрж╛рж░рж╛ рж╕ржорж░рзНржерж┐ржд; ржПржЯрж┐ рж╕рждрзНржпрзЗрж░ рж╢ржХрзНрждрж┐ ржпрж╛ рж╕рзВрж░рзНржпржХрзЗ ржЙржЬрзНржЬрзНржмрж▓ ржХрж░рзЗ ржПржмржВ ржмрж╛рждрж╛рж╕ржХрзЗ ржЙржбрж╝рж┐ржпрж╝рзЗ ржжрзЗржпрж╝; ржирж┐рж╢рзНржЪржпрж╝ржЗ рж╕ржорж╕рзНржд ржХрж┐ржЫрзБ рж╕рждрзНржпрзЗрж░ ржЙржкрж░ ржнрж░рж╕рж╛ ржХрж░рзЗред тАУ ржЪрж╛ржгржХрзНржп,2ыЕД ьаД,0,
