username,comment,time,likes,reply_count
@MichCort,"Hugh Cipher Ye I'm lucky I live in Belgium, we have good medical insurance (never got ill though), so I get that but thats the only excuse. financial mistake is your own fault and actually school loans are too, a job in Mcdo pays the bills too, not everyone can be a C.E.O.  (Not that I can judge because here college costs 1000 dollars a year, but still)",10년 전,0,
@robertc2488,Perpetuates victimhood and entitlement.  I was taught in elementary at a public school how to balance a checkbook so that I could earn the right to have a bank account.,11년 전,0,
@chriswili9918,"My question is, at the end of the video it speaks of the businesses that are providing hope. It talks about how they are, but does not say who they are. I feel that is something that should be placed in the discription at the very least since it is not in the video.   I am very interested to know what business in San Fran is allowing other to lend to one another as a new form of obtaining needed money.",11년 전,0,
@chiyerano,"Ah, alternative banking with check cashing places and the like.  All I can say is thank goodness for local credit unions. ",11년 전,19,
@Swagger6679,"It's hard to place blame anywhere. Can you really blame the bank? They have to make smart loans that they can profit from, just like any other type of trade. The only thing they can base their loans on is credit, what else can they do? They can't simply just lend out money because there are people that don't return it. Also, with some of these guys, it's not very unbelievable that they would be in debt. For example the nurse doesn't have to send her child to private school, i do believe that would have saved her around 25 grand and she didn't have to quit her job. As for the musician's family. They don't have to get their kids the best they can because they don't have the means to do so. If times are hard, we need to give up some of our luxuries for survival. When i say luxuries i don't mean luxuries by american standards, but luxuries by third world country standards.",11년 전,1,
@dgr8zod," I run scap metal to get day.  I have no sympathy at all who will not do what they can do to make ends meet.  Be it a lower paying job, or two, like that's never been done..  I am tired of the entitlist BS.  ""The world owes me as living""..",11년 전,1,
@eliasponcianojr5692,Wow that's pretty depressing ,11년 전,0,
@bebeysmael1.,"I always say, so long as we're breathing, we still have hope. I actually live on $400.00 per month. I go to college full time and I work part time. I'm going to be 53 in September and I started my life over, by myself, in 2011. It's rough, but, in my perspective, things are better now than they were before 2011. Thank God and thank my daughter. So, long as I'm breathing, I still have hope. I was almost murdered in 2011. I have died and come back to life. Once your dead, you have no hope. Thank you Young Turk for sharing these wonderful life stories. I think that if you and I pull together and help each other, perhaps things can get done. :-)",11년 전,1,
@bebeysmael1.,"This is so messed up. I hate seeing a good music artist lose their stuff. I hate seeing someone with the gift of creating good fashion art lose their stuff. Parent's with children like Jonah should not have to suffer this way. I had to quit my job and move in order to take care of my MOM  and AUNT who both had cancer. It's such a sad, sad thing.",11년 전,0,
@bebeysmael1.,Nice,11년 전,0,
@403hj,It is too bad this was in the middle of the documentary I was trying to watch. ,11년 전,0,
@philliptjackson,"I remember when I had $40,000 in cash saved up, and I couldn't get a mortgage for $120,000, because I didn't have a credit history.",11년 전,1,
@M0THERSHIP1,"Wow this is hard to watch, i wish that things get better for all of us.",11년 전,1,
@huikoplmn,This is scary. It makes me want to try as hard as I possibly can.,11년 전,0,
@llcoolray3000,"The FairTax would help all Americans, especially people like these. fairtax.org",11년 전,0,
@parahax7977,"14:50 great work as always TYT, lets make banks loan to everybody regardless of credit score because that's not what caused the housing crisis.",11년 전,0,
@Dhime,"This is a fucking joke. Government is exactly why these people are having trouble, it's not the private sector. But of course The Young Turds are Socialist, so expanding government and criminalizing the private sector is what they're all about.  How about taking personal responsibility and not take fucked up loans, not have kids when you're poor and can't afford to feed yourself much less them. Or starting small with less valuable materials than what you ""want"" to build... It's simple, really. Each one of these people are living beyond their means..  I could rant all day about this feel good help me bull shit these Socialists push. Fact is, these people are a minority. Why don't they do a documentary of the people leeching the system so they don't have to work? Oh, but no... That would expose what these Turds want, which is total dependance on the state, no personal responsibility and the destruction of what's left of the free market.",11년 전,0,
@YouriCarma,Money is very expensive if you are poor.,11년 전,0,
@Lemonz1989,"Everything seems so unreasonably hard in the US. I live in Denmark and I use one card to withdraw money and shop - it's a debit card, but I can still buy stuff even if my account doesn't have any money (it just becomes negative) and in return I pay 18% interest a year for the overdraft. It usually amounts to a few dollars a year for me - maybe around $5 at most. We are also required by law to have a bank account and it's illegal to use individual credit ratings, so no denial of loans due to poor credit - only poor payment history or too low income. Bills go through a national standardized system, and if the bill says payment is due the 1st of July, then you can pay it the 1st of July. The company is the one that has to wait for it to clear if it doesn't clear immediately (which it most often does).",11년 전,1,
@clintcbrantley5542,I can see anarchy coming in this country. The haves versus the have-nots.,11년 전,2,
@marcusbrinkman3066,Its a film about becoming a socialist or Marxist I guess..the socialist utopia?,11년 전,0,
@chiyerano,Student loans and payday loans are some of the worst kinds of debts a person can have. ,11년 전,9,
@ippothedestroyer,"chiyerano  Got a student loan in 2006, payed it off in 2013.This helped my credit history and credit score tremendously.",11년 전,2,
@chiyerano,"ippothedestroyer I did the same thing around 1999 or 2000. Still doesn't change the fact that student loans are some of the worst loans you can have in that the only way to get rid of them on your record is to either pay them off or be forgiven the debt. You can't discharge them through bankruptcy like you can with credit card debt.  If you were dissatisfied with the education you received from the college or university you went to, you cannot just go back to the school and demand the money back either. ",11년 전,5,
@deeman010gdj,chiyerano You should still be thankful for 'em. The amount of people in other countries don't even have that option and are forced to work right after Highschool. Of course.... it might not actually be in your favour if  student loans saturated the jobs market..... idk.... hard to analyze.,10년 전,0,
@velvetice100,THE 414 PEOPLE WHO DISLIKE THIS VIDEO MUST BE THE FOLKS WHO ARE IN THE 1% OF RICH FOLKS WHO HAVE NEVER FELT WHAT IT WAS LIKE TO EXPERIENCE HARDSHIP :(,11년 전,0,
@velvetice100,This is how most people are living in the real AMERICA!,11년 전,0,
@SamuelColeMBA,FACEBOOK GROUP  DONATING FOR A GOOD CAUSE https://www.facebook.com/groups/YBMCORPORATION/,11년 전,0,
@cwbimp,"ignorance  will cost you dave ramsey can help i like seeing ppl driving nicer cars than me tattoos and smoking cigarette and broke  make better choices you don t need a new car  drive a pos  i blame our schools for not educating ppl on how mortgagees interest, and loans work  you mean i can borrow 200$ and pay back 500$ were to i sign.  keep you head up the ppl that are millionaires have been bankrupt once or twice  ",11년 전,0,
@chipjumper,"If waiting a day or two to cash a check tears you're entire life apart then you need to sit down and regroup your thoughts, processes, and setup some actual goals. What this video fails to show is where every nickle of every paycheck is being spent. It doesn't show all of the people blowing the check on chewing gum, beer, drugs, etc.  The only one I could see that could use actual investment is the purse girl as she has a viable business that doesn't need a head start but needs investment into capital. Entrepreneurship is the future of America as this country as already on thin ice. Do Not Maintain Debt!!! NEVER! STOP DOING IT! Save money. Borrow from yourself and pay yourself interest. Stop wasting money. Life will go on if you have to buy the ""off brand"" toilet paper.",11년 전,1,
@Dianaranda123,I say go out pick up a nice sturdy stick and beat these bastard capitalists out of there offices.,11년 전,0,
@Roarmeister2,"Paying by paper cheque?  That is so '90s.  I write on average 1 or 2 cheques per YEAR and that is only because the receivers aren't set up for debit or credit cards.  I haven't seen the inside of a bank in years for paying bills, cashing cheques, etc.  Everything has been done electronically via online accounts since 1996!   America is a third world country and so backward its not funny.  Allowing health expenses to take control over your daily life is insane!  We've had universal health care since the '60s in Canada and pay half of what Americans do for HC!  $100k in student debt for a degree she isn't even using is absolutely beyond stupid!",11년 전,0,
@valdencorr2861,"FUCK, respect to that black lady, what a human being. This is the ROLE MODEL the black community needs, not fake rappers and gansters, this lady should be on main stream media teaching EVERYONE how to be a decent human being.",11년 전,0,
@TheBella2u,"Purplmutantas, I agree with what you say about people buying stuff they don't need, etc. but cut these people some slack, your comment leaves me thinking that you didn't watch the documentary.  The husband and wife who used payday loan, their child was diagnosed with Autism and the husband, Alex MS.  Not a stupid decision.  The young man explained that he was young and dumb.  I think thanks to the internet and the speed for which we receive data has compromised our ability to actually absorb what we are seeing, resulting in quick judgements.  Truth is the last 10 years have been brutal to the United States labor market.  It's a complex discussion. Watch the documentary Too Big To Fail. People have been replaced by machines and cheap labor outside the US. Have a little compassion.  Their story could be yours.........",11년 전,1,
@dragonlordx25, No way a talentless few like the Kardashians should have a net worth of dozens of millions of dollars when we have this going on to people everywhere. Its just not working. Its sickening.,11년 전,0,
@asdflkaj6291,why do people watch this show?  The show is named to honor the Turkish revolutionary group that committed genocide on the Armenian people.  Shameful.,11년 전,0,
@EugeneShamshurin,"If you need help, ask for help. try Learnvest, get your act together.",11년 전,0,
@biggiejackson,"TYT Gotta be the stupidest SOB ever so if You don't give Loans your racist and if you do give loans your a greedy preying on the weak and prolly racist too.... This sickens me,",11년 전,0,
@RUdigitized,The solution: DON'T GO TO THOSE STUPID LOAN PLACES. No one is making you take some damn responsibility for yourself.,11년 전,0,
@candy144,Obama's America. It will get worse before it gets better.,11년 전,0,
@RUdigitized,Justin needs to learn how to manage his money better.,11년 전,0,
@YvetteE0000,"well since Tyler Perry is involved in human trafficking, slavery, using people's intellectual properties for movies without consent, illegally filming people without consent, knows that Hollywood and the politicial systems have destroyed many people lives then this documentary is not true to form.  Since Tyler Perry is in cahoose with the Jackson family, Michael Jackson's employees and his continuing silent and cowardice wars against me and others, this film is no where getting to the cause of human trafficking and the collapse of the economy. Hollywood is the major cause of crimes against humanity in this world.  His quest to rule the world came into fruitation including Janice who wants to be Satan too. He even take over the body of Obama/Osama who is Michael Jackson, Afroo Oono, Pitch Nova, Joel Berkley, and many more aliases he and his clones possess.",11년 전,0,
@mrane1,0:42 $150 for phone! 7:50 Pay for the cable!!! That explains it!,11년 전,0,
@benwhite24,"Wow...... Powerful. Just, wow...... My family and I are so blessed to have what we have. Maybe we have ""earned"" it... Maybe we have had many underserved chances. Perhaps we are just lucky... I don't know...... But, I truly take what I have for granted. {thought} Lord, Thank you so much for everything my Family and I have been blessed with. We are so grateful and Thank you.",11년 전,0,
@lisajohnson6992,They are lucky they have overdraft. They would simply have to get the lights cut off until they made enough to get back on track.,11년 전,0,
@mizzybillz2326,This came on as an ad and it's the first one I didn't skip especially amazing considering it's length,11년 전,0,
@markborishnikoff5485,I found a commercial on this on the avgn website and the commercial goes on longer than the actual video or about the same time. I don't understand why the advertisement was so long.,11년 전,0,
@FrankRivera129,"who is debbie and how can i contact her, i want to help fund her bags",11년 전,33,
@StephenGriffinsmartguy2000,"it is possible to overcome odds without going into extreme debt. If your immediate family pressures you into debt tell them know and avoid them unless of course you're married. Just be frugal with your finances and shop carefully bargains are to be had if you look diligently on products you need or desire. Luxury brand names are not always required. For food supply grow an indoor or outdoor garden or both, if your community has a community garden take advantage of that.. As for buying a house save cash for that and purchase a modest very low cost house or trailer and add on to it as time goes by (in a good neighborhood of course) My Generation and succeeding generations are going to have to make big sacrifices until the Cancer known as the Baby Boomers are dead. Baby Boomers are the worst thing that ever happened to America. ",11년 전,2,
@StephenGriffinsmartguy2000,Not to be a hater but people must learn to do their homework before even graduating from high school. Except in rare circumstances it is possible to avoid most of these problems or have a sufficient buffer when shit happens. Live well below your means in the good times and when the bad times hit you;ll have the resources to pull yourself through. ,11년 전,0,
@Minuz1,"I'm wondering, wouldn't moving to a different country help these people? What would happen if you would move to Canada?",11년 전,0,
@Alice89chan,BBC bans anti-science cranks.  That means TYT will never appear on BBC. The irony!,11년 전,0,
@purplemutantas,"One of the things that really struck me about this documentary is the bit at the end where it says ""Presented by American Express"". Am I really expected to believe that a credit card company really cares about poor people? The kinds of people shown in the video are profitable to credit card companies.",11년 전,0,
@purplemutantas,"One problem I have with these sorts of documentaries is that it's all about how the big bad capitalist system is screwing people. There isn't enough attention payed to the people them selves and any poor financial decisions they made. The fact is, many Americans do stupid things with their money. I wonder how many people who ""need"" a payday loan only need it because they spent money on something they didn't need. You need to take care of needs FIRST, then take care of wants. You need to evaluate a ""need"" to see if it's really a need. Far to many people spend money on ""needs"" that aren't really needs. Then they don't have enough money to pay their power bill or whatever. Also, when people have more money; rather than saving it, they spend it! I remember when my dad got a better paying job. He decided to upgrade to digital cable. The basic cable we had was just fine. We had plenty of channels to choose from. But he decided to go for the more expensive option because he could. It would have been better to take the extra money and put it in savings. This sort of thing happens all the time. People get a raise and suddenly they need a new car, or TV, or whatever. People need to stop trying to keep up with the Joneses.  I am an Anarchist so I am opposed to Capitalism. It would be great if we could abolish such a horrible and exploitive economic system and replace it with something more just. But that's not going to happen any time soon. So as long as we have the kind of system we do, we need to educate people so they can make better financial decisions. That is an uphill batter unfortunately. People who are smart with money aren't as profitable as people who are dumb with money. All those fees and interest add up to a whole lot of profit.",11년 전,83,
@StylishlyUnemployed,"I'm in the same shit situation as most of these people here, and I feel for them, all except for the girl who started her handbag business. She got a one hundred thousand dollar degree and has a job that doesn't require a degree. She didn't come from money either according to this video, so why did she get such an expensive degree she knew she couldn't afford. It sucks but that's just poor decision making on her part. Still, I hope that she becomes successful and that it works out for her. Title loans are complete bullshit too, fuck those vultures.",11년 전,0,
@luiss7150,You grab your bills you burn them start from scratch satisfy your most basic needs and declare bankruptcy ,11년 전,0,
@SiaGrath,"This is stupid. The proposed solution is stuff like ""movie screenings"" and ""prizes for saving money"". da fuq? The issue is (and always has been) that our government is in bed with all of these corporations who are now able to legally fuck over anybody they want for any reason. cable companies control the FCC, big banks control the federal reserve, pharmaceutical establishments do whatever the hell they want because they know many people's options are literally ""pay or die"". Hell, most of the top earning companies like Verizon are paying LESS than 0 dollars in taxes (look it up if you don't believe me). I mean our last financial crisis was because banks were intentionally plunging families into debt and then trading the debt around like pokemon cards. What was our governments response? Bail them all out! We are basically trusting these corporations to regulate themselves at this point, which is really just fucking stupid. This country was bought and sold a long time ago, coming out with documentaries that encourage people to 'save money better' isn't going to solve shit. That's like being on the titanic. heading straight for the ice burg, and responding by encouraging everyone to practice treading water.",11년 전,0,
@bonwhite8805,Help me every time I watch vids this ad shows up and it take like5 hours to load no joke.,11년 전,0,
@undrcoverlouky,"Wow. I cried. I don't do that often. These people aren't dead beats. They are people who have followed the recipe for success. Just their ""bread didn't rise"".",11년 전,0,
@derekmartin8127,This documentary really doesn't say much or anything about the root cause of the problem. Government tampering in the economy and destroying the dollar through the federal reserve. Too bad it just goes the way of Michael Moore and just tugs at emotions to try and make its point.,11년 전,0,
@LittleBoyWonder3556,Us & Them... How can mortal man fight evil?,11년 전,0,
@leeannzee8438,Watch the video on autoplay on my channel -- this is a warning about some of the voices in alternative media.. making you poor,11년 전,1,
@ihyperizei,also on the topic of student loans if you go to college and take out 100k in debt to study arts or histories then you're at fault 100%. the demand for people with liberal education is so slight because those degrees show no skills that benefit any profitable company whatsoever.,11년 전,0,
@ihyperizei,"People need to be more assertive and aggressive when it comes to conquering capitalism at its core. My grandma grew up poor, raised on a farm in Tennessee. shes now a multimillionaire with a large enough stake in BBVA(Spanish based bank) to be invited to private dinners and parties overseas. my dad sits at home and trades stocks and options from his mac while drinking his Starbucks. hes living a life of freedom and enjoyment. people need to realize money is something easily obtainable because its fucking everywhere! there is too much of it! just get your foot in the door and stop relying on others for your success. ",11년 전,0,
@suzy18me,"Very motivational.. By watching this, I became more responsible ;)",11년 전,1,
@rwdyer2263,Try and contact the Young Turks and see if they can get you in contact with her. I'd like to help too but I'm in the same boat they are. :(,11년 전,2,
@patsmith6805,"If you click on their name below the title of the video and to the right of the channel logo, it'll send you to their channel's main page. On the main page there will be a title picture and below that the channel name. Below the printed channel name are different tabs, one labeled About. Click there then scroll to the bottom of the page. To the right of a flag symbol with a drop down arrow there will be a Send Message sign. Click there then type what you want and send the message. Maybe you can contact them that way. Hope I helped!",11년 전,4,
@ProArch,http://debil.us/ is where her bags are sold. Looks like she tried to do a kickstarter campaign that ultimately failed to raise the capital she needed.,11년 전,6,
@purplemutantas,"ProArch I find it funny that she named it Debil. Débil is Spanish for weak. She's from Argentina, so she should know what it means.",11년 전,3,
@ProphetChuck8471,Did you contacted her Frank?,11년 전,0,
@ThePurpleclone,purplemutantas That's why she put Debil and not Débil.,11년 전,1,
@paolomancini823,purplemutantas Amazing what an accent mark can do... because the last thing she is -- is weak. ,11년 전,4,
@derphands,Doing god's work Frank! Thanks man.,11년 전,2,
@XawsomegirlX,purplemutantas Lol. Where i'm from Debil means moron.,11년 전,1,
@FrankRivera129,Update found her store on Feb I'll keep u all informed on what happens but thanks for the advice guys appreciate it https://www.facebook.com/Debil?refsrc=http%3A%2F%2Fwww.debil.squarespace.com%2Fcontact%2F&_rdr,11년 전,3,
@Lordsigmaroy,"Her name is Deborah Artaza, 1461 N Corlies St Philadelphia, PA 19121-3504",11년 전,3,
@ProphetChuck8471,"Frank Rivera Cool, keep us updated! :)",11년 전,0,
@Alice89chan,"Hates capitalism.  Bought a computer at Walmart/Best Buy/Sears/Target, made by Dell/Toshiba/HP/Compaq/Acer/Asus for OS Windows/Apple/Linux.  Is an anarchist. Doesn't live in Somalia, closest to anarchism in the planet.",11년 전,21,
@purplemutantas,Alicia Hernández de R. You're just being a troll but I will play your game.  I built my computer. I purchased the parts at a local computer shop. For desktop computers I always prefer to build my own. For the OS I use Linux mint. I prefer open source software over proprietary software. The last version of windows I used regularly was XP. I have been running some flavor of linux or another since 20008.  Somalia isn't a very good example of Anarchism. The Zaptatista communities in Chiapas Mexico are a much better example.,11년 전,12,
@kaseybrown7664,"Alicia Hernández de R. Right.  Because if I need a computer to survive in the modern world, I have a choice NOT to buy it from Walmart / Best Buy / Sears / Target.",11년 전,3,
@purplemutantas,"Athena Brown There are other options. Freegeek in Portland offers refurbished computers. A used computer from ebay is another option. Depending on what you need the computer for, there are tons of older computers that will do the job just fine. Take an old XP box and put a copy of Linux on it and it will work fine for basic web surfing and word processing. You can't be perfect in our society, so you do what you can.",11년 전,4,
@markborishnikoff5485,"  Try being an anarchist in the stalinist ussr or during the one hundred flowers campaign. You'll be killed. Also, does it really matter to you what other people spend their money on? They're not killing you and you do not know them, so leave them alone.",11년 전,6,
@darrenmanzie6219,You are thinking to small.  Do you think having a financial education will make people hire you full-time?  Do you think an unexpected medical event cares about your financial education?  Do you think student loans are going to take a back seat to your financial education?  The problem is rooted much deeper than a financial education.  So I guess the woman who gave up her full-time job to take care of her mother or send her child to a private school made the wrong decisions.  Says who? You!  Do me a favor it you have a problem with the concept don't watch the content.,11년 전,10,
