username,comment,time,likes,reply_count
@jinto1980,"I vote Democrat because I believe it’s okay if our federal government borrows $85 Billion every single month.  Yet Bush 43 took a budget surplus and fucking it real hard so he could give countless billions to his crone capitalist friends.  I vote Democrat because I care about the children … but saddling them with trillions of dollars of debt to pay for my bloated leftist government is okay.  Yeah I care about children too. My county just announced that next year all the students at school would receive a free breakfast and lunch. Why did they do that? Because many of the parents couldn't afford to pay for a school lunch. This last year those who couldn't pay where given a sandwich and a piece of fruit. While that is a fine meal for the likes of me. I'm 33 overweight, and a diabetic. So that low carb shit is right down my alley. However as a child not having a good breakfast and a lunch is really not good. Sadly that was the only meal some of those children would get for the day.  I live in North Carolina I was shocked when I heard about this. However that is the great thing about local government. They actually give a shit about the people. The new program is a possibility because of a federal grant. So yeah they aren't getting saddled with anything. If anything they could benefit from far more federal money. Education system I'm looking at you.  I vote Democrat because I believe it’s better to pay billions of dollars to people who hate us rather than drill for our own oil, because it might upset some endangered beetle or gopher.  Gee do you really want to drill for oil. When the sun and wind are so much easier to reach. While it might be more expensive now it is what you call a long term investment.   I vote Democrat because I believe it is okay if liberal activist judges rewrite the Constitution to suit some fringe kooks, who would otherwise never get their agenda past the voters.  Yet the supreme court which has a conservative majority. Seams to think that corporations are people... And that money Isn't a corrupting force.  I vote Democrat because I believe that corporate America should not be allowed to make profits for themselves or their shareholders. They need to break even and give the rest to the federal government for redistribution.  I got nothing against profit. I do have something against deregulation and predatory consumerism. I also like taxing them so that we can improve the infrastructure of the nation. Which the majority of those corporations use to make profit.  I vote Democrat because I’m not concerned about millions of babies being aborted, so long as we keep all of the murderers on death row alive.  Yup because killing a person is wrong, and ending a biological function is not.  I vote Democrat because I believe it’s okay if my Nobel Peace Prize winning President uses drones to assassinate people, as long as we don’t use torture.  Yeah I don't think that!  I vote Democrat because I believe people, who can’t accurately tell us if it will rain on Friday, can predict the polar ice caps will melt away in ten years if I don’t start driving a Chevy Volt.  Go watch last weeks episode of cosmos. Very good way of showing the differences in climate and weather. So much so that I will not butcher it here.  I vote Democrat because Freedom of Speech is not as important as preventing people from being offended.  You got a right to say some hateful shit. I also have the right to tell you to shut the fuck up if you don't have anything nice to say.  I vote Democrat because I believe the oil companies’ profit of 3% on a gallon of gas is obscene, but the federal government taxing that same gallon of gas at 15% isn’t obscene.  Sounds like some ole bullshit to me. Sure I think it is cool that the government taxes gas. Like I mentioned before NC has a gas tax South Carolina does not. Let me tell you. You can tell the difference. North Carolina roads are great compared to SC. Pot holes are rare and major roadways are touched up or repaved every decade or so. SC is full of pot holes. The roads are decades old with really shitty patch up jobs. The difference in a price is anywhere from 15-25 cents per gallon. So you can have cheap gas, and shitty roads.  I vote Democrat because I believe a moment of silent prayer at the beginning of the school day constitutes government indoctrination and an intrusion on parental authority ….. but sex education, condom distribution and multiculturalism are all values-neutral.  Go pray in a church, schools are for everyone including those of other faiths or none at all. I wonder what you would say if a satanist group requested the right to pray to the dark one on school property. Sex education was a course I took in the 5th grade. I'm talking we got the full story. It wasn't controversial at all it was something our parent had learned in school. Condom distribution is a good idea, as safe sex is the best sex. Multiculturalism isn't that what America is all about. You know the ole melting pot ideal.  I vote Democrat because I agonize over threats to the natural environment from CO2, acid rain and toxic waste ….. but I am totally oblivious of the threats to our social environment from pornography, promiscuity and family dissolution.  Why should I worry about pornography. I thought you where for free enterprise and all that jazz. That shit sells if you know what I'm sayin. Promiscuity... hell as long as to people have an understanding of an open relationship that is cool. Now just sleeping around with a lot of single people. That is 100 percent cool in my book. You only have one life to live. If fucking like a monkey is what you want to do go for it. Just be safe you dig.  I vote Democrat because I believe lazy, uneducated stoners should have just as big a say in running our country as entrepreneurs who risk everything and work 70 hours per week.  Hey that is how the system works. I fore one really like the idea of stoners voting. When was the last time you ran into a angry stone dude. Not like those old white hate filled conservatives. Sorry ode white stoners didn't mean to lump you in with the rejects.  I vote Democrat because I don’t like guns ….. so no one else should be allowed to own one.   I  enjoyed shooting bolt action rifles when I was in the boy scouts. I understand the need for them. However I don't see the need that anyone should be able to own an automatic weapon. I've had a 38 police special for more than 2 decades I haven't used it once.   I vote Democrat because I see absolutely no correlation between welfare and the rise of illegitimacy.  Can the welfare system be abused? Yup. However I doubt that has anything to do about unmarried females giving birth to children. If anything the reduction of abortion services, along side a lack of good sexual education.  I vote Democrat because I see absolutely no correlation between judicial leniency and surging crime rates.  Do you even live in this country. The only people who get judicial leniency, are rich white kids, rich white bankers, rich white war criminals like Bush  43.   I vote Democrat because I believe you don’t need an ID to vote but you do to buy beer.  Yup cos voting is a right. While drinking is a regulated activity. You must be this old to party.. move along.  I vote Democrat because I believe marriage is obsolete, except for homosexuals.  Na marriage is okay especially for my gay brothers and sisters.  I vote Democrat because I think AIDS is spread by insufficient funding.  I go with that and here is why. In the 1980's the government knew about AIDS. I'm sure if they had spent a little money on a massive PSA would have made people more aware of it. Being aware of something usually increases your chances of avoiding it.  I vote Democrat because I think “fairness” is far more important than freedom.  How can being unfair to someone not infringe on their freedom.  I vote Democrat because I think an “equal outcome” is far more important than equal opportunity.  I believe in meritocracy. However since we don't live in a world where everyone gets the same perks as the others. If the state has to step in to make sure that everyone gets a fair shake at something so be it.   I vote democrat because I would rather hide in a class room while others fight for my freedom.  Oh spare me your jingoism. Today's solders aren't fighting for my freedom. I love them for doing a job that takes more balls than I have. However today's solders live and die for nothing more than the financial gains of corporations. Something they should never have to do.   I vote democrat because I’m not smart enough to own a gun and I need someone else to protect me.  Your not even trying anymore. We've already talked about guns. Yeah I'll tell you right now. If there is a deadly situation, and I had the option to call the police. You bet you damn ass I will. That is why I pay local taxes.  For police, fire, and emergency services.  I vote democrat because I would rather have free stuff than freedom.  Again not trying. Who says you can have freedom and free stuff. Like education and medical care.  And lastly, I vote Democrat because I’m convinced that government programs are the solution to the human condition, NOT freedom.   Yeah last I checked starving people didn't last long on freedom. It taste good but it isn't filling. Your being silly as if you can't have both.   I'll give you credit for this rather long troll post. Oh who am I kidding you copied this of some site on the web. All in all thanks for the writing practice. Not perfect by a long shot, but rarely do I dedicate any time to it. ",11년 전,6,
@TruthAndMoreTruth,"If you really think that, you should vote republican. Reagan and bush, both two terms, fail miserably to positively affect the federal deficit.",11년 전,0,
@theearthcircus6664,"jinto1980 Wow lol, I give you credit for attempting to answer most of it.  While the post I copied is too conservative for my likings, it is comical and brings out some good points, perhaps even inducing thought-provoking debate.  Your answers are the typical feel-good, try-to-do-what-you-THINK-is-good, uninformed Leftist immature fantasies.  While many of the conservative values make me want to vomit, the Leftist reaction is twice as bad.  I was hoping for some better answers, but I think this is the best I'll get on an extremist leftist channel.",11년 전,2,
@theearthcircus6664,Blah b Sure.  The national debt exists primarily because we don't tax people enough.  Statements like that are why people who failed economics shouldn't post their opinions in public.  Maybe when the tax rate is 95 percent you'll feel better and our economy will be booming.,11년 전,1,
@jinto1980,"The Earth Circus  Sure i'm a leftist, but i'm willing to negotiate on the policies of the country. There use to be something called a middle ground.Where two groups of people from both sides could meet. They would work together and find a solution they could both deal with. That just doesn't happen in politics anymore. There is a difference between ideals i have and policies i will accept. ",11년 전,2,
@theearthcircus6664,"jinto1980 I encourage you to watch a few videos of Infowars or Stossel.  I believe the majority of you leftists have not given Liberty a fair chance or a fair listen.  Most people who actually listen to both sides will not be Leftist afterwards.  There's a reason democrat voters are primarily young and inexperienced, and many of those same voters change to conservative as age, wealth, and world-experience increases.",11년 전,1,
@redryan20000,The Earth Circus unfortunately nothing you say has any reason behind it. you just make tons of assertions about people you want to belittle.,11년 전,1,
@theearthcircus6664,"redryan20000 unfortunately your comprehension levels are quite low, even for a TYT viewer.  I don't believe you're savable.  Most leftists will grow out of it though.",11년 전,1,
@CrownedFalcon00,"The Earth Circus First off i am not a Democrat, i am a liberal.  I don't buy into the right-wing pseudo-liberals that are called democrats. Second I have taken many classes about business and economics and it has only strengthened my beliefs on this matter. Our financial system only benefits the rich and at this point most things benefit the rich.  The tax loopholes and breaks that have gotten the taxrate of the wealthy and corporations is at an all time low.  During the 50's-70s (early 70s). we had the greatest economic boom ever and guess what.  The US had tons of regulations, fair wages and high Tax Rates on Wealthy and  Companies.  At the Same time small businesses were given fair shots and thanks to teddy Roosevelt many years before there were laws in place that prevented trusts and monopolies.  At this time public services were at an all time high and people like Eisenhower did NOT run deficits instead they ran a Surplus while adding government programs.  Even Nixon (who i don't like very much) did things that were good because he listened to the people rather than money.    Now money runs politics and that cannot be denied.  The financial system is a wreck and only serves the people who make money off it.  The same goes for insurance.  They don't care if they screw the average american in order to make a quick buck.  That is how the banking bubble that caused the collapse happened, DEREGULATION of the banks that allowed them to make bad loans to many Americans. The financial System is the same way they want to make money not serve the people. Without the FDIC and others we would have had the Depression part II.  Also there is no evidence to show that welfare decreases productivity.  I'd argue that social safty nets increase productivity for the reason that it allows people who fall on hard times such as the people in this video to get back on their feet without falling into a never ending cycle of loans and bad choices because they have to.   Are there going to be abusers? of course there are its bound to happen but the societal benefit is greater than the downsides.  The funny thing is most of the money the government borrows goes to military contractors and very little goes to social programs.  If you want to blame overspending blame the military industrial complex that profits off of meaningless wars.  I also believe in the rights of people.  People should have the right to do what they want as long as it doesn't hurt others.  This includes, sex, drugs, and rock and roll.  Does this mean people should cheat? no.  Does this mean people should drink and drive? no.  Does this mean that people can commit child molestation? no.  Does this mean  that bestiality is legal? no.  A conscious consenting adult shouldn't have to conform to society.  The funny thing is that when you legalize drugs you get a decrease in drug use and a decrease in crime associated with drugs, this includes violent crime. Rehab should be the name of the game not locking them up behind bars. They didn't harm anyone, prisons shouldn't be for profit and they shouldn't be for just locking people up.  They should be for rehab to put people back into society.  People become hardened criminals in prison most of the time not when they are on the streets, and yet if you have money you don't have to go to prison even though you led the call to run the American Economy into the ground.  Instead the companies get bailed out instead of bailing out the american people and helping them stay afloat when a company screwed them.   Funny thing as well things like cable companies run monopolies in their regions.  This is due to a lack of regulation and this lack of regulation has caused american internet connections to be slower and more costly than in other places around the world.   A little added note on guns, most liberals are PRO gun... However many liberals want regulations on guns so that people with mental illness and people with prior histories with violence cannot get them and kill people. Guns are a privilege because they have the power to make the killing of people very easy.  They were designed TO KILL, and as such shouldn't be given to every person who wants one.  I don't care what the second amendment states, the second amendment is an older, more archaic of the amendments. I respect your rights but i don't want your right to own a gun to allow you to take away my right to live. A gun is a responsibility.    In Short, Taxes should be higher the more money is made.  We need to invest in education and R&D of new technologies.  We need to Regulate business so it doesn't destroy competition and wipe out smaller businesses.  Internet, Electricity, Gas, Water and others need to not be private enterprise, these are necessities in this day and age and shouldn't be for profit.  They should work to improve efficiency and make things less expensive not more expensive and make money while keeping the same infrastructure.  Our infrastructure needs to be improved, our roads, bridges and buildings are lagging behind other nations, and  we need to help the american people.  Life isn't fair, but that doesn't mean we can't give everyone with a dream a fair shot at their dreams. In this current system the poor rarely get to do great things and the rich can do everything.  Money shouldn't be a determining factor when someone is born, great people come from all walks of life.  If we stifle the next great scientist of musician because money didn't allow them to do that then that's our fault as a society.  ",11년 전,0,
@theearthcircus6664,"CrownedFalcon00 Wow that's quite a book you wrote there.  I agree with much of your sentiments.  The problem is that small businesses are regulated out of the market, while big banks are not regulated.  It should be the opposite.  So much of crony capitalism pushes regulations onto the smallest fish while alleviating them for the biggest banks and corporations.  The problem with much of what you have wrote, regarding the ""safety net"" of welfare and ""needing higher taxes"" is that you are forcing successful people to pay for unsuccessful people.  Taxation is the #1 idea of the communist manifesto, and also the major reason for the American Revolution.  Kings tax, free-market economies do not.  America had no income tax from 1776-1913, which was the largest economic boom for America that created wealth, prosperity, liberty, and became the beacon for immigrants to desire to come to.  Tell me, since you claim well versed in economics, do you support Austrian or Keynesian economics?",11년 전,2,
@drmorqWarrenProject,but NONE of what you 'wrote' is true. I would say that you are a paid troll because no one believes the tripe you are posting.  STOP LYING...  the earth circus  #DrMorq  ,11년 전,2,
@oneseraph,Troll,11년 전,0,
@ACHJ0424,"The Earth Circus  Troll, please go back into your cave instead of wasting my screen space.",11년 전,0,
@dontbeamuppet,"The Earth Circus I think there is a longer term trend happening. Corporations are now global companies that are beyond regulation. They have 'headquarters' in tax havens to minimise the tax they pay. Manufacturing can be switched to sweat shops in China, Vietnam or Malaysia. A small elite are grossly enriched. They have massive influence - using their endless cash reserves to control politics. Trickle down from the 'job creators' is a con. The best you'll get is serving coffee to them on minimum wage.",11년 전,1,
@theearthcircus6664,"dontbeamuppet Really?  That's the best I'll get?  How come I am able to start successful businesses every year?  How come I made over a million dollars in the last 4 years?  How come Mark Cuban started a business and quickly became a billionaire?  Because ""the best we'll get is serving coffee to the corporatists for minimum wage' ?",11년 전,1,
@SuperToughnut,"The Earth Circus Okay.  Well, let's review your background.  Where did you grow up?  Were you, your siblings, and your parents healthy growing up?  How about now?  Any health issues?  What kinda of businesses have you started?   How did you get the money to start your businesses?  Did you get money from friends and/or family?  Did the money come from a bank?  Have you had any struggles in life that made it difficult to get the money to start these businesses?  Using these facts maybe we can come up with a solution for the people that are struggling.",11년 전,0,
@theearthcircus6664,"Toughnut I grew up with nothing, and turned it into something.  Rags to riches.  The problem with people who continue to struggle is that they just are not smart or competent enough to rise out of their situation.  And smart successful people are too busy being successful to have the time to teach unsuccessful people how to do it.  Although, there are many books and videos available of how to be successful by people who got successful by writing and selling the book.  That may sound ironic, but that's precisely how it works.  Being healthy is an important part of it all too, definitely.  Most successful people agree that it's not easy.  But humans are natural problem-solvers.  People just need to identify their problem and then work towards fixing it.  Of course having successful friends and family is a huge benefit, but not a requirement.",11년 전,1,
@Destructionsan,The Earth Circus  So what you're really saying is... you're successful because you lack empathy.,11년 전,0,
@theearthcircus6664,Destructionsan So what you're really saying is... your reading comprehension is equally as bad as every other TYT viewer.,11년 전,2,
@purplemutantas,"I voted for Ron Paul because I am opposed to Fascism.  I voted for Ron Paul because the federal government has far to many ties with corporations.  I voted for Ron Paul because I am opposed to war.  I voted for Ron Paul because I believe that smaller government applies to all government including the department of defense.  I voted for Ron Paul because I believe that the federal government should penalize states that have legalized Marijuana.  I voted for Ron Paul because I believe the federal government should stay out of the abortion issue.  I voted for Ron Paul because he believes in the ideals this nation was founded under  And lastly, I voted for Ron Paul because I couldn't vote for Thomas Jefferson.",11년 전,1,
@theghasynchroduck,"If your credit score is really poor, or you have a history of checking accounts in the red that never get paid off...or were closed by the bank,  you won't be able to open a checking or savings account. I know some people where this is the case. Their only option is to use check cashing services because banks and credit unions won't allow them to open accounts. ",11년 전,4,
@vonhuben,"None of this is just circumstance, it's the way the system is designed to work. Big Financial gets bailed out by the taxpayers but the taxpayers are turn into wage slaves by Big Financial. The majority of money made in this country doesn't come from the wealthy, it comes from breaking the backs of the middle class and poor. The poor and middle class pay a larger portion of their incomes in taxes, fees, and in usury based interest than the wealthy and they get to live shorter, brutish lives on top of that. But at least it's not Communism right? I mean it does the same but Capitalism is good while Communism is evil.",11년 전,0,
@NeccoWecco,checks are so obsolete,11년 전,0,
@priasethecow,Sad movie... the banks are screwing the poor,11년 전,3,
@thewhiterabbit7783,WTF????? presented by AMERICAN EXPRESS????? they are trying to whitewash themselves. fuck them they're not any better than GOLDMAN SUCKS!!!!! boycott this fucking documentary!!!!!!!!! DISLIKE!!!!! and The Young Turks better take this off. about to unsubscribe after many years. i bet i won't be the only one!!!!!,11년 전,0,
@kessler_could_not_care,it's a sad world we live in,11년 전,0,
@The2005rwb,BAN PAWN SHOPS BAN PAYDAY LOANS BAN CHECK CASHING CABLE IS A HUMAN RIGHT HOME OWNERSHIP IS A HUMAN RIGHT CAR OWNERSHIP IS A HUMAN RIGHT,11년 전,5,
@kwphillyzkp2,no wonder they start making porn,11년 전,0,
@relik0fages,The credit system is not credit. It ends up becoming a form of slavery. They should give it the rightful name of DEBT.,11년 전,0,
@germandrummer13,Looking for Change and not one mention of Obama...interesting.,11년 전,0,
@thediltarget,Use Bitcoin and Cryptocurrency! No need to be tied down to the banking and loan system.,11년 전,2,
@germandrummer13,Man I feel for the woman at 32:38. Now she's going to a government run institution. Ouch.,11년 전,0,
@heavymetalzombie9226,Our fucking Government needs to watch this . Its so sad to see this happening .,11년 전,0,
@KevinTheNoobie,It's got a nice VICE feel to it.,11년 전,0,
@marynuah6375,"Yes, tears rolling all over my chest why watching this awakening abundance message from you T.P.I'm pretty much crying because I am going through the same abuse, I'm receiving. And watching those others people that have gone through what's am facing right now I lost my emotions. Thanks for Documentary. I am relocating, my first step. I had started to giving up but God is giving me another chance. ",11년 전,1,
@pennynavarro6034,I have been in some of the same situations as these people.  I have to say that it is a blessing that I have  been able to get out of some of them and working on the rest.  God Bless each and everyone.,11년 전,0,
@MasterTaiki,lol. I'm unemployed.,11년 전,0,
