username,comment,time,likes,reply_count
@moeghafffari,"The sad part is Banking is a rigged game as we all know it. The check cashing industry is just another ""super pac"" donor that basically legally working gangsters.  ",11년 전,0,
@IShotMyLastMuse,"very well mad, but also so depressing. I need a few drinks now.",11년 전,0,
@piercecohen,The Young Turks should do more documentaries like this!,11년 전,1,
@Blankname101,Sad I hope things get a lot better for them.,11년 전,0,
@BobTheBob647,Not really. They're funding a hit-piece on a competitor--makes sense. Imagine Subway funding Super Size me  ,11년 전,2,
@watchsymposium,Good point. They aren't exactly the enemy of debt though. Taints the doc a bit for me.,11년 전,3,
@ClaudeConkrite,"***** You ever thought, maybe they don't have any credit genius ? U r in the twilight zone you privilidged pompas asses. There are many MILLIONS of people of ALL COLORS that don't and never have had the opprotunity to get a credit account exept at fingerhut, the corner ""rent a center"" or a payday loan shark. Do you live on 325 a week after taxes ? Probably not. 80 percent of caucasions are born into money, and the adverage white man makes 70.000 a year while most make 15.000 or less. Live on that and have a car, you got to get to work, and what about rent and food and shit, clothes, damn, what about heat, and maybe a little air conditioning. Is a TV too much of a luxury ? What about a phone, is that overspending? Tell me what should a person give up, childcare while they are at work ? Or maybe they just leave their kids at the park while they work, they will be fine.",11년 전,0,
@briandupre1494,"Claude Conkrite Wow, feel free to supply those figures there Claude. I'm a white man (caucasian is an incorrect term) and I make less than $30k a year working full time in my late twenties in a management position. My father worked as a roofer his whole life, like all my uncles and grandfather did. I'm nearly positive not one of them ever made $70k even in their best year, maybe $50k in a good year and they earned that money. You know who they hired? Mostly other older white guys with no skills who would work like dogs for $12/hr because they didn't come from money and had no options. It's pretty ignorant to throw race into the equation, it's all about socioeconomic class. My black brother in law's dad is an engineer, his mother a public school principle. He went to college and never had to pay a bill or get a job himself until after college. A black friend of mine's family is from Zimbabwe and his parents owned diamond mines and they are LOADED. Haven't you ever seen Chris Rock's standup where he points out that the majority of Americans on welfare are white? Just because you grew up in a community where the white's were all ""rich"" and priveledged doesn't mean it's like that everywhere. Go to parts of Maine, New Hampshire and Massachusetts and you'll see poor as shit white folk all around. Go to the Nevada desert or parts of eastern Oregon and the poverty would blow your mind. Better yet, seek out the pictures of Bobby Kennedy going to West Virginia where people live in lean-to homes and trailors with no roofs and the family splits one potato for dinner. Divide and conquer, when we only take race into account we fight ourselves. When we realize it's really a class issue and we are ALL getting fucked, maybe something will change. ",11년 전,0,
@atomicjacob6413,"and what of the criminals that caused the recession facing? nothing, they are still in their mansions sipping whiskey and laughing.",11년 전,1,
@dafv2011,I find it hard to feel that bad for most of these people.  Justin and his girlfriend are still so young and at the end he says he has no hope.  That is ridiculous.  Justin made some stupid decisions and it is going to take a few years but there is no reason he won't be able to buy a house someday.  It sounds like it has already been a few years since he stopped paying his credit cards so he should be able to get another one soon and start rebuilding his credit.  It will have a high interest rate but he should spend at most 20 bucks a month and pay it off each month.  Within 5 years he will have a great credit score.  That will give them time to save up a 20% down payment if they cut expenses as much as possible.  People just want everything to happen immediately and have no patience.  It takes years of hard work and sacrifice to get ahead financially.  If they were somehow able to get a house right now they would probably pick one that is to expensive for them and they would have almost no down payment.  Then if there is a recession and his business goes down they will be in deep trouble very quickly.    I can't even imagine why the nurse would have her daughter in private school.  That is just stupid.  She should have been in public school all those years and then her mom would have had more in savings.  Her daughter has an educated mother who can teach her so she would do just fine in a public school.  Private schools usually aren't even much better than public schools.  It is just all the kids who go there come form privileged backgrounds and so they do well.  I don't get this obsession about schools.  You even hear rich people complain that they are just so strapped financially because it is so expensive to buy a house in a good school district.  Well cry me a river.  You could buy a house in a slightly less good school district.  Where did we get this idea that we can't send our kids to school where there might be any poor people or non native English speakers or else they will be failures in life?  I went to elementary school with poor people but I still did fine and went to college.  When you are a single mom you can't just quit your job even if your mom is sick.  Even in nursing your skills will atrophy and it is going to be harder to get a new job the longer you are out of it.  If you are out of it to long you might even need to take a refresher course before you can get your license back.  She should have at least continued working part time at nights or something like that.    Why did Debbie the handbag designer go to such an expensive school and fund it all with loans?  I really do admire her dedication and her talent though.  If she was my friend I would give her a 1000 dollar loan with no interest to buy materials without thinking twice about it.  I know I would get paid back because her stuff is good and it would sell.  I hope she can find someone to help her out so she can expand production.  A craft business like that will always have limits though since there is only one of her and she can only produce so much even if she has all the materials she needs.  I guess if she gets famous enough maybe she could license her name to someone that could mass produce a handbag line.,11년 전,0,
@savvasithaka,"if this documentary doesn't end up giving a bunch of time to elizabeth warren's genius proposal for the post office to offer banking services, i'll be so disappointed.",11년 전,0,
@astat1,"Gold standard, Americans. That is what you need!",11년 전,0,
@grogan1970,I had an idea that might help the women that makes purses. Since she has demand for her purses from her established clients she should ask for the material costs upfront. I am in construction and we do this all the time on larger jobs that we need help funding. If you do good work and you are in demand you will be shocked at what your clients will do for you if you only ask. I hope this helps.,11년 전,1,
@Fifty1stState.,Excellent quality documentary.,11년 전,0,
@MahoganyConsulting,Excellent!!!!,11년 전,0,
@freshrr2,This country is fuuuuucked,11년 전,0,
@Bustermike86,"Woooow... so this is the American reality, thank God I live in Germany!",11년 전,1,
@BrotherWoody1,"A nice presentation that arouses empathy, the necessary key to problem solving. Every human has load & power. The rich have the power to reduce their load, the poor do not. The Western poor are as much of a generational caste system as the Indian dot heads.",11년 전,0,
@thetgwarrior,11:23 DO IT ONLINE!  Why drive around to pay bills?  12:11 um...wat?  Why bother doing all that? Any person with a brain would realize how much money he's wasting going through 2 fees + 1 per transaction.  Get a fucking bank account anywhere...a credit union...credit unions are nice to you usually.,11년 전,0,
@philipbourne,"An the American Dream is just that, because you have to be a sleep to believe in it.",11년 전,1,
@CrownOfTheTown,I can't take my eyes off that Debbie girl. Driven and gorgeous. I think she's amazing.,11년 전,0,
@Veggamattic,Is it wrong that when I see people with money problems that are fat all I can think is diet will save you money.,11년 전,0,
@knightbrucie,Look into bitcoin as an alternative,11년 전,0,
@STACEYSFUNNY,dont bother watching it has a big time pro banking pro credit undertone ... ridiculous  unsubbing youngturks,11년 전,0,
@andrewtenorio,wow..so many views ,11년 전,0,
@davidnissan9507,I feel the pain for the couple and the entrepreneur. great documentary. way to have it hit home,11년 전,0,
@GenerationVideoGamer,Share this film. This is an accurate picture of the current financial system for most Americans. It needs to be fixed.,11년 전,1,
@calilifestyle,This Documentary is great and i can relate 100%. But what's the solution I've yet to find or see a solution to the problem. ,11년 전,0,
@thatsnotagoodidea,Join a credit union.,11년 전,0,
@WilliamWellham33,"I have zero sympathy for these people. The system does not need to change, people just need to learn to live within the parameters that have been set. There is absolutely no reason you can not make something happen without debt being involved. Follow simple rules such as pay yourself first, invest/save wisely and most importantly protect what you have. Smart choices should be made at all times when concerning ones finances, age and circumstance are no excuse if you simply apply fiscal discipline.",11년 전,0,
@michaelbone6183,Glad I live in Canada. Three of the people wouldn't have anywhere near the same problems here.,11년 전,1,
@Cinepobrefilmfestival,"leaving the country would be more rational than expecting change at home, no more comedy central, emigrate and find the life worth living under beautiful foreign spacious skies",11년 전,0,
@BobTheBob647,"How about America adopts a radical new idea...an idea that the entire Western World basically already follows: student tuition ought to be at a reasonable rate and/or free AND health care ought to be provided by the government so no family goes bankrupt from an illness.  I know...radical, eh?   - Peace & Love, from Canada",11년 전,0,
@Devofone,"Wait the film guys solution is rather obvious, just hire your wife as an employee and put her on the company payroll as something arbitrary.",11년 전,0,
@malibu14111,Fake views.,11년 전,0,
@IamSpacedad,The neighbors that paid off the family's loan are real stand-up people!  Someone who did something like that for my family would be best pals for life.,11년 전,2,
@evbb,"Awesome doc. Admittedly though, it makes me want to stay further away from banks and electronic transactions than I already do. All credit ends up being is a false idea of what you can afford, without actually being able to afford it at all. Instead of getting a home loan for $300k, buy a piece of property for $10k with cash up front. Instead of buying a brand new car that's value drops by almost half the second you leave the lot, buy an old Toyota that will probably outlive you. Grow your own food.  Harvest your own energy and water. interact with your community and look out for each other. If you have to spend money, make investments with your transactions, don't gamble on solutions.",11년 전,0,
@energyparticle,I need to start a check cashing service......,11년 전,0,
@thertc204,"Wow. This movie showed up as a pre-roll advertisement between some videos I was watching. Normally I would have skipped as soon as the option came up, but for some reason I kept watching. Before I knew it, I was 20 minutes into it and hadn't even realized.  This film was incredibly shocking and really pulled at my heart strings. I may not live in America, but this video really did help paint a clear picture of some of the troubles that plague North America.",11년 전,0,
@garywhite3255,The major financial institutions have robbed us blind. They will keep sucking the blood out of the people until the people realize that we no longer have a stake in America. The change will not be a peaceful one. There will be more and more stories of what were once normal people snaping and lashing out. Its already happening.  Fire and blood death to the bastards!,11년 전,0,
@SuperToughnut,"A lot of these negative comments lack empathy.  These people probably read ""Atlas Shrugged"" and believe in magic bootstraps.  Do you think everyone has the same opportunities as you?    There are millions of people struggling in this country.  What would you do to help these very real people?  What won't you do to help these people?  ",11년 전,0,
@nakianiteshade,"Anyone who thumbs this video down is either Rich , in denial , or both. Either way you slice it , they're an asshole. This video isn't even touching how bad it really is getting out here. But I'm still happy they shined light on this economic epidemic. ",11년 전,12,
@MrNerd243,Good thing my university's tuition is only $123 per year. I think I can handle it without loans. Especially when I also get student benefits from the government. It's kinda sad that not everybody can get education as cheaply.,11년 전,0,
@fujinmage,"when will people learn two simple, yet vital things about economy: 1. Debt as money does NOT work, it NEVER has and it NEVER will 2. Dollars, euros, ect is NOT money!!!! True Money must RETAIN their value over time (decades, even centuries) and the only thing that has done that in the past is Gold & Silver!!! Throw ALL the worlds money printing presses in the trash and start minting coins made from gold & silver and depressions and financial crises will be a thing of the past. ",11년 전,0,
@Guib77,Payday lenders are vile pieces of shit preying on vulnerable people...Thank goodness they're illegal in my state. ,11년 전,0,
@Guib77,but fear not for America is exceptional and blessed by God...right? ,11년 전,0,
@Ultrox007,"I notice the pattern that all these people have lives and have goals...  What about the people who apply everywhere, can't get a job anywhere, and are eventually forced into the military because it's either that, suicide, or go homeless?",11년 전,3,
@morzik12345,isn't it kind of hypocritical for a celebrity who lives in the world of luxury to be making a film about the problems of the poor?,11년 전,6,
@TurdFurgeson571,I see plenty of people picking themselves up as high as possible by their bootstraps. Still think that's all people need to do to make a comfortable life?,11년 전,0,
@deborahsmallwood3925,made me cry to see how many people from every background...living and struggling just like me. In this country that claims to be the land of opportunity...why are we the people so damn poor.,11년 전,5,
@aarondavid826,So this is a doc about stupid people?  These people should go to the library and read a Dave Ramsey book,11년 전,1,
@Ultrox007,Support your local credit union and public transport options people.  Don't let your ego ruin your wallet.,11년 전,0,
@iamadorknblonde,"An average American today pays more in taxes than they spend in food, clothing and housing combined, something TYT and the left advocates more of. Most of it is wasted in Washington. That is the real tragedy.",11년 전,7,
@goldeyeblue,"Interesting documentary, 7 or 8 minutes in and continuing, I got to say, it's great that you are humanizing the lower class and working poor, who I here far to often described as nasty parasitic leeches, mooching off the economy. Clearly these people are hard working, caring, and dedicated individuals, struggling to get by. But could use more statistics on the side, a little more talk on the macro picture.",11년 전,2,
@Joseph565112,"Any bank that received tax dollars in the bailout (code for saving their sorry asses), no longer have any right to discriminate against people who pay taxes due to their credit history.",11년 전,0,
@SoGladUCame,"AMEX purchased TYT. Amex is horrible. They jacked up interest rates during the financial crisis of 2008, lowered limits arbitrarily, and couldn't have done more make it more difficult. In my opinion AMEX is a horrible company and the Young Turks are sellout jokes for associating with them, if they did any research they'd know what kind of company AMEX is, I'm sure they do know though, so you decide on their integrity. ZERO.   Never missed a payment, when had AMEX credit line. ",11년 전,6,
@RGVZGM, #Bitcoin  is a new kind of currency that does not suffer from the inflated fees and predatory profit seeking behaviors of the banks.  Please investigate a resource based economy.,11년 전,3,
@Bagcap,"Notice how many are in the state of Texas, which claims to have a booming economy.",11년 전,0,
@maarc3D,"Released on the 4th June but has 4,000,000 views??? On TYT channel???",11년 전,0,
@zoralinman,"People who answer with ""You know what you signed up for"" definitely don't understand that some decisions aren't choices.",11년 전,22,
@dirrenbb,i cried,11년 전,0,
@VonKaNon,"Oh look, it takes people helping people, not govt helping people, to make real change. Forget HOPE and start embracing community. Helping your neighbors is helping you, too. ",11년 전,0,
@drdwgmd14,Amazing documentary,11년 전,0,
@LVC85costa,"damn, thats messed up. seen these pay day loans on an rt doc too, its crazy. its sad seeing people working so hard for so little and they are the people that make the economy go by buying, banks have to go and let gove produce interest free money",11년 전,0,
@damnruskies,"Welp, I cried like a little girl :( ",11년 전,0,
@jslovin23,This is what it is like for anyone with bad credit or anyone who can only find a minimum wage job.  It's just affecting more people these days because it so hard to find employment and the economic crisis in 2008.,11년 전,0,
@boxingisthebomb5050,Takers!!!!   #Sarcasm  ,11년 전,2,
@godly111,"Freedom is about choice. The more choices we have, the more free we are. Welcome to the new age of slavery.",11년 전,2,
@aljo909,"I'm sure you're not just repeating an unsupported fact from elsewhere so maybe you can tell us the source. What I found from a quick search is this site which gives all the sources for the stats http://www.justfacts.com/taxes.asp#distribution  It only goes to 2009. The effective income of the middle 20% of households was $64,300 with a federal tax rate of 11.1% or $7,137.  From here  http://realtormag.realtor.org/daily-news/2012/01/03/what-does-average-home-owner-pay-mortgage  you find an average mortgage of about $200,000 with an annual payment of about $12,000. Maybe your state takes too much taxes. Fix it at the ballot box instead of whining.  So in summary: average family federal taxes of $7,137 mortgage payments $12,000. You still have to add utilities, food and clothing to this which must take the spend beyond $20,000 in total. Do you have a source for your stats or are they 'Palin facts'.",11년 전,1,
@iamadorknblonde,al jones The source is Tax Foundation with data from Bureau of Economic Analysis:  http://taxfoundation.org/blog/americans-pay-more-taxes-food-clothing-and-housing-combined,11년 전,1,
@maryleestromquist2645,"Melissa, Cato and Mises advocate similar Libertarian arguments, and like all advocates of any philosophical idea.....right or left ..... are highly selective about which stats the use, and how they use them.........very convincingly.  With 316 million people making the best decisions they are able, and ignorant of both history and multiple ways of interpreting any issue, not to mention bombarded by 40 years of propaganda, it's unsurprising we've landed where we have.  I'm old, and heartbroken this tragedy occurred on my generation's watch....tho to be accurate, we were sold it by a handful of powerful interests when we were very young......the same interests which/who hold power today.    Yes, there is such a thing as society.  Yes, our individual choices influence our lives.....but to think any of us is ""in control"" is naive, usually the province of the young, whose experience is limited.....simply not enuf time on the planet to have been tossed off the merry-go-round a few times.    A favorite analogy of mine is thinking of a society organized like an insurance company.....a non-profit insurance company.....in the sense of all of us paying in, and if/when the bottom falls out, there exists a safety net.  Sound like socialism to you?  My social insurance company would include health, education, public infrastructure........kind of like what our government used to do. Before....  Before privatization convinced us it was cheaper/more efficient.....but turned out not to be.  Before Milton Friedman posited that the primary purpose of a corporation was to return profits to its investors.  Hey....sounded good on paper.  Little did we know the incentives that little idea would create.    Are we citizens, or consumers?  Roughly half of qualified citizens bother to vote. (granted, the choices are usually appalling.....and whose fault is that?)  A third of us have passports, but that number increased dramatically post-9-11, due to passports being required in Canada and Mexico.  A typical American read 5 books last year.......an extrapolated figure from a self-reported survey by Pew.  28% of adults read no books.......again, extrapolated.  No indication of which books, of course.    With no exposure to other cultures (having swallowed the We're #1 b.s. whole), we don't realize how ignorant we are.  We don't bother to sort thru issues, preferring knee-jerk reactions to our biases.    We actually do get the government we deserve......which is, after all, my depressing point.",11년 전,0,
@aljo909,"Melissa Vasquez The site you linked to is comparing apples and pears. It quotes 'average income' then looks at the global tax from all sources - not the tax paid by an individual or family. It's effectively smuggling in tax paid by corporations etc as if it's tax paid by individuals.   OECD figures  http://www.oecd-ilibrary.org/taxation/total-tax-revenue_20758510-table2 show tax as a percentage of GDP.  The table lists the 33 most developed countries. The U.S. has the lowest tax burden apart from Mexico. If you compare the 10 most developed nations (highest GDP per head) then the US is significantly lower than them all. e.g.US 24%, UK 35%, Germany 36%, France 43%, Norway 43%, Sweden 45%, Canada 30%. ",11년 전,2,
@iamadorknblonde,"al jones Even if you take out corporate tax the average American pays more in taxes than for housing, food and clothing combined. Second corporate tax is paid by individuals - it's either paid by the shareholders or the consumers. And what has other countries paying more have to do with anything? What a nonsense argument, as if two wrongs make a right. Countries like Singapore, Hong Kong and Switzerland all have a lower tax burden, and people there are much better off than other developed countries, including the United States.",11년 전,0,
@aljo909,"Melissa Vasquez ""Even if you take out corporate tax the average American pays more in taxes than for housing, food and clothing combined."" Show the source of your figures (a reputable source, not a claim in a blog).   ""corporate tax is paid by individuals - it's either paid by the shareholders or the consumers."" No, corporate tax is paid by corporations. The 'bottom 80%' owns about 5% of financial wealth. Your original post talked about the 'average american'.    Singapore and Hong Kong are tiny economic zones. It's ludicrous to compare them with a major industrialised nation. Switzerland makes a lot of it's money by providing secret bank accounts. Not an option for the U.S. Even so, according to OECD figures, Switzerland's tax base is 28.2% compared to the U.S. at 24.3%  ""And what has other countries paying more have to do with anything? "" It has to do with making a like for like comparison against other major industrialised countries. That would seem a reasonable way to determine whether or not a country is highly taxed. That's how you find out if a country has a high crime rate, mortality rate etc.   There are 34 countries in the OECD table and the U.S. has the LOWEST tax take.  Your claim:- ""An average American today pays more in taxes than they spend in food, clothing and housing combined,"" was total bullshit.  Total tax revenue As a percentage of GDP  http://www.oecd-ilibrary.org/taxation/total-tax-revenue_20758510-table2",11년 전,1,
@monsterkis,"No they didnt, they sponsored them, a sponsor does not own a thing within the company, shit face",11년 전,1,
@WhatsInYourShoes,Who's pay is given to them in a cheque format in this 21st century??? ,11년 전,0,
@6dawie9,Bitcoin can help bypass all these headaches with banks,11년 전,0,
@mm-lu5zr,report please ,11년 전,0,
@mm-lu5zr,35 dakikalık reklamı Türkiye'de alt yazı olmadan vermişler. Her sitede bu video çıkıyor. Ahmak mı desem iş bilmezler mi desem bilemedim...,11년 전,0,
@0dontspeak,Almost 4 million views in 2 days and only 500 comments? hmmm,11년 전,0,
@michaelgrella,"God bless America my ass. If there is a god, he really just cares less. ",11년 전,0,
@priceandpride,downsize,11년 전,0,
