username,comment,time,likes,reply_count
@BurritoSupreme42,Good luck,2개월 전,0,
@cambry4932,Debbie is doing quite well now! She's made a great life for herself and is now a creative director at a fashion company doing what she loves. She also has a husband and kids :),4개월 전,0,
@clonecommandermike332,Who's watching for school?,1년 전,0,
@El_Struggler,Debbie should charge a deposit for bulk orders to allow her to buy the materials she needs in advance. Just a suggestion. I hope you they all prosper.,1년 전,0,
@GravityK-b,Love or hate Young Turks for me at least this was a pretty informative documentary and from time to time even with some disagreements I have with them I still have to applaud and see where they do right.  It's a good way to learn about the world through different perspectives.,1년 전,0,
@jacobjordan22,can someone tell me 10 facts about this for my school asssignment,1년 전,1,
@Fruad_jo,22:24,1년 전,0,
@matthewingerson,Right-wing politics are pro-wealthy-class-autocracy politics. Right-wing politics are anti-working-class-democracy politics. Reject the right-wing politics of the autocratic wealthy-class minority and their mob-rule over the working-class majority.,1년 전,1,
@tobyrichardson4867,I wonder the pandemic affected these ppl?,1년 전,0,
@dankong9233,Anna and Cenk are bigots against trans people,2년 전,0,
@tm502010,"It’s so very easy to sneer at the “Poor” in this country, not understanding that a vast number of people are only barely afloat -including many of the people sneering… 😢",2년 전,1,
@TheVelvetLoungeLife,"Wow this was 8 years ago. I hope that Debbie uses recycle materials from thrift type stores. It would bring her cost down so low, she would think that she won the lottery. As my grandmother would have said, every little bit helps.",2년 전,0,
@RighteousRider17,Great Title: playing with words…  word smart,2년 전,1,
@rodrigop7423,"there is no such thing as making the system better, this whole facade should be dismantled",2년 전,0,
@knudsandbknielsen1612,"""To ensure a separation of powers, the U.S. Federal Government is made up of three branches:  Legislative, executive and judicial. To ensure the government is effective and citizens' rights are protected, each branch has its own powers and responsibilities, including working with the other branches.""  The banking system seems to be like ""The Money Police"", the fourth and very private branch, designed to drain society of money, which translates to power, and to oppress the poor majority into desperation and madness, and to make money grow inside tumours that look just like humans to the immune system of our Pavlovian senses.",2년 전,0,
@Stigmaballs,"""Keep your money, I want change.""",2년 전,0,
@LarryDRoncali,And yet we wonder why mental illness and addiction are skyrocketing across the board. Let’s not forget the Republicans want nothing more than to rug pull everyone.,2년 전,0,
@SgtStarSlayer,Going to university for an uncertain future with no cash to go to university? Blame it on your parents not able to secure the future of ones children? not the problem of the bank.,2년 전,0,
@kylesuperbaby9616,Capitalism is pure Evil,2년 전,2,
@jamesdunn6333,2 things. What's tragic is the people who SHOULD be hearing this message never will. And as the film was ending YouTube suggested an ad to sell my un-fertilized egg. Lol,2년 전,1,
@honorladone8682,I'm happy to have a lovely apartment .,3년 전,0,
@honorladone8682,I'm happy to have a lovely apartment .,3년 전,0,
@Sulfen,Wealthiest country in the world yet it all goes to the wealthiest people and corporations. We need to figure out our priorities.,3년 전,0,
@ixchelssong,This.,3년 전,0,
@kylebailey8950,I'd like to move over seas but don't know where. Anyone have any good ideas?,3년 전,0,
@rezo147,This is obviously before onlyfans they all could open one and be aight..,3년 전,0,
@jacknasty6940,It’s a system to keep you down and saddled with debt A lot easier to control those barely surviving,3년 전,0,
@sanderdeboer6034,"At the end of this video I truly KNOW the USA is a HORRIBLE country for most of its citizens. Feel so sad for people that need to live in such a horrible place, and feel lucky I was born in a true civilized society that does care for its citizens.",3년 전(수정됨),0,
@sanderdeboer6034,"Those overdraft fees shows how evil the ‘systems’ in the USA are. Not to mention the fact that many Americans don’t have health insurance (30 million) or are underinsured (65 million). And I feel the fact that so many Americans are overweight is also partly caused by this. Here in Europe people have healthcare insurance as a right and by law.  This means that the government has an incentive in keeping people healthy and pay for preventative healthcare.   Also it means that investing in public transport, cycle infrastructure and walkable environments pays of. In the USA it seems society is designed to make lives of regular citizens as horrible as possible to maximize profits.",3년 전,1,
@CliftonBowers-pc2xu,"Note lived in texas I left that hell hole loving not having any utility bills, lower housing cost, lower taxes, yet l live in California...Texas is full of shit period!!!",3년 전(수정됨),0,
@johnscott2218,Inflation  is a  MASSIVE tax hike on the poor and Biden has risen it to a 46 year record high. Every price incerase is a tax increase and Biden is gouging  us for a 8.6% tax hike on consumer goods and a 39% tax increase on gas. We need to impeach  China's Proxy CCP Chairman  and send him back to Wuhan....,3년 전,0,
@Trump_is_a_moron,The only reason for people to be struggling has to be due to corruption.,3년 전,0,
@lis819,America sounds like a dreadful place to live...,3년 전,0,
@roupa131,Tax the rich 50% over $300 million,3년 전,0,
@coloradobrad6779,"8:57. Yup. I had my account once to be exactly zero. Guess what happens when your bank account hits exactly $0. It closed. I did not go over draft, just zero. I asked them and they said yes if you go overdraft we charge you a fee and keep your account open. If you go to $0 we make no money so we close it. 😳",3년 전,1,
@jefflilyea4669,Ridiculous quoted costs. Stupid spending.,3년 전,0,
@ClassicRuby,"Masterful job in detailing the very real, very broken problems while still making the humans and their humanity, the every day underdog, the most important part",3년 전,1,
@ZEUSs_Paw,"Tiffany, you're a great Mom! Wishing you the best lady.",3년 전,0,
@ogxs1433,"Don't complain about movie prices, if your willing to pay the theives 5 or ten dollars for popcorn then you are the fool...",3년 전,0,
@quintinphillips,This is capitalism for those without capital.,3년 전,2,
@lydia695,17:00,4년 전,0,
@gingercox6468,You can always do a go fund me.,4년 전,0,
@gingercox6468,Getting credit is easy. Borrow $1000 from a bank use the money to pay the loan.,4년 전,0,
@colinsmith3945,Depressing.  Gives me traumatic flashbacks to when I was in my 20s.  I used to have to budget $20 for two weeks of groceries.  Condensed soup was my savior.,4년 전(수정됨),10,
@bonniegaither3994,"And of course the stupid republicans advice is, “well, just get an education and a better job”. 🙄🤬",4년 전,0,
@doukdondada9587,"Look at the Politicians that’s running this country and it should give you a clear understanding about America’s values, divide, fear and hate towards each other!😞😡",4년 전,0,
@silverarm6130,Still relevant.,4년 전,0,
@fernandomurillo9272,Don’t give up America 🇺🇸 only you can make it better. God bless everyone,4년 전,0,
@livingtoaster1358,"""Blessed is the man who perseveres under trial, because when he has stood the test, he will receive the crown of life that God has promised to those who love him.""",4년 전,0,
@livingtoaster1358,OMG I have the exact same poster/ hang up that they have on 30:44,4년 전,0,
@boyax7825,me comment today. same still,4년 전,0,
@bruingold,"I just found this. Does anyone know if any follow up was done with these people? I so want to know if things have improved. But sadly, that's probably not the case.",4년 전,0,
@USMCCGAGNG,Money is an illusion. There are enough resources on this Earth for EVERYONE…. The rich are all scrambling to get it all for themselves. They run the system. They run the governments and they run the world.,4년 전,0,
@USMCCGAGNG,"The rich put you down and do everything they can to keep you there, working as hard as you can to recover. They are profiting more from you when you’re desperate. So they keep you there. “It’s called the American Dream because you have to be asleep to believe it.”",4년 전,0,
@lesliestenta3084,"The damn corporations and their monopolies are sucking every last dime from us. One example is my phone bill in the US is  179 a month, in Thailand I pay $7 dollars for unlimited data a month.  In the US I had a cobra payment of $600, in Thailand I don’t need healthcare insurance. I had to go to a hospital in Chiangmai my bill was 900 Baht for ER, Doctor and meds. My total cost for my healthcare 2.5. Years in Thailand was under $200.",4년 전(수정됨),0,
@williamlouie569,"With minimum wage $ 7.50 for the last , what ,30 to 40 years where everything cost gone up 2-5 times.  How can these workers survive?",4년 전,0,
@cux4032,who else is here because of school,4년 전,1,
@lorilouwho6804,This is why I stopped using banks!,4년 전,0,
@Priestofgoddess,"United States of America, land of the free, but only if you are wealthy enough to afford it, otherwise you are just enslaved on a less obvious way for the rest of your life.",4년 전,1,
@cesarconh895,I hope the next active shooter happens at a banks corporate office,4년 전,0,
@ptedoc,Is that Tyler Perry talking😂,4년 전,0,
@glennjohn3824,The system works just fine actually... these people are bending over backwards to avoid being responsible for their decisions. Victim porn...,4년 전,0,
@bobbuilder5902,Lmao. This was made by American Express.,4년 전,0,
@jeffreyrichardson,doug linda and deb george bush and his brother jeb now twenty two feb,4년 전,0,
@thebeast9869,I live in the uk get paid straight to bank account and don't pay fee's to spend money checks is that even a thing anyone does anymore hahaha,4년 전,0,
@its_isaac1557,This video made me sad and it makes me more thankful for what I have it also makes me scares for the future,4년 전,1,
@NotFlowza,Who watches this for fun?,4년 전,0,
@Revolverben190,I have come here from finance class and was told to watch from 9:08 to 12:47,4년 전,0,
@christheone248,"Merica, Land of the free! What a joke, but Mericans cant see it",4년 전,0,
@mor8969,"This may sound stupid so I apologies I'm advance but doesn't America have a social system to help with some sort of social benefits on people who are disabled, suffer with cancer and people who are carers etc.",4년 전,1,
@davecarter9203,Covid 19 has decimated the middle class.  Basically finishing it off for good.,4년 전,1,
@BasementDweller_,College gang where you at?,4년 전,0,
@manurmad1539,Just get a bank. Not that hard.,4년 전,0,
@AA-yt9ch,"Most expensive are kids, fix this by not having kid. Problem solved",4년 전,2,
@ellenorbjornsdottir1166,this is actually an AMEX funded documentary,4년 전,1,
@lore5886,came from NGPF,4년 전,0,
@jeffreyrichardson,jodys matinee mark mahlerts own hot lunch tray laurie shermans say,4년 전(수정됨),0,
@blushydabest,9:07 - 12:47,4년 전,0,
@sevenjackson1951,i hate commercials  :(,5년 전,1,
@Blowtsmane,anybody else watching this for a bullshit school assighnment,5년 전,1,
@ItzFlamingGamin,"ah yes, the finance homework",4년 전,0,
@cursedchapter3746,"Hmm... The Young Turks... Our school system isn't biased in any way, shape, or form.",4년 전,0,
@budfinks,"As difficult as life can be , we all need to stand together . This system is unjust , it needs to be torn down and replaced . There are people and parties who are committed to that end .",5년 전,0,
@ashjoma,"Would be interesting to see an update on all these families, especially how coronavirus has now affected them. Hope they were able to get through the last several years since this was produced.",5년 전,0,
@jeffreyrichardson,live within your means pay your bills stop making scenes focus on your dreams,5년 전,0,
@Nick-yi5gt,9:08-12:47,5년 전,0,
@susan572,I don't know of any nurse who can't get a job. Especially with an MBA.,5년 전,0,
@susan572,"The girl who makes purses should be working other jobs in addition, in order to make ends meet. You can't make a living selling a purse or two. And does she have a wholesale vendor's license? Looks like she's paying retail for her supplies. I don't know what kind of degree she got at what type of school that cost $100K--because most state schools will be far less expensive than that. And she could have started at community college for basics. There have been a lot of bad decisions made here and she continues to make them.",5년 전,0,
@JadedJassy21,Coronavirus has humbled a lot of people..since this video,5년 전,0,
@FireTeamGamingairsoft,"Monica ""Stockholm"" Gustampido 10:02",5년 전,0,
@gueroodoubleo1375,Who else is being forced to write about this?😂,5년 전,6,
@paulhung3648,I have to watch this for school,5년 전,0,
@octowhoa7573,Ay bruh just like... get more money,5년 전,0,
@fairytail0711,This makes me wanna stay a kid my entire life,5년 전,2,
@jeffreyrichardson,mike doug plus jody scott andrew and chief brody arrid temps gobi,5년 전,0,
@jeffreyrichardson,jodys subscription waits for fathers permision dougies submission,5년 전,0,
@teresashortnacy9472,Why can't Justin open an account at a Credit Union so he can cash checks without paying an exorbitant fee?  I wouldn't open up a bank account.  Do not like banks; they have a bad history,5년 전,0,
@ЮрийЗмановский,"Pennywaise. For people with a healthy sense of humor, scary tales for adults.",5년 전,0,
@brianwilliams3667,Wow what an excellent video. I got into payday loan problems because of video poker. At one point I had 6 payday loans at the same time. I asked my dad for help and we went in and paid everyone of the loans off and haven't looked back.,5년 전,0,
@dnd5733,What are some of the disadvantages of being locked out of or choosing not to belong to the traditional banking system?,6년 전,0,
@BernicePanders,"I am literally dying, in my 30s, of TERMINAL STRESS heart failure, have MS, 8 failed back surgeries, and a dozen other debilitating symptoms. I have had 2 massive heart failures already, and have an imminent terminal diagnosis, thanks to one thing: Not being allowed to get a VEHICLE OF ANY KIND, so I can move to where my necessary meds are not taking up HALF my disability income, where I can see the specialists who can treat me & not ignore me!!  It is virtually IMPOSSIBLE TO SURVIVE on disability if you've never been allowed to get a job, because you were blessed to be born disabled in the richest country in the world!! Where the most greedy, self-absorbed, lazy, lying, hypocritical, racist, sexist, corrupt leader this nation has ever seen, can spend more on one meal than I am expected to exist on per YEAR!! Where he's made the deepest cuts to medicaid, DHS, HUD & food stamps than any POTUS in history, and I've never in my life had to go without so much food, toiletries, meds, etc.  America's fake facade of being some 'land of the dream life' BS is a dangerous web of lies, snaring millions & millions of people into an endless hell, some of us are giving everything to put an end to...",6년 전,0,
@dancrussell8344,Capitalism: There are those that eat and those who get eaten!,6년 전,0,
@cursedchapter3746,"Yes! Lets replace it with an authoritarian system, and defeat the infinite threat of RED China!",4년 전,0,
@Lyfewithlysha,who else had to watch this for a class? lol,6년 전,2,
@BadNeenersBrown,Public banking reduces fees and what fees they do collect are reinvested back in the local community.,6년 전,0,
@GuidodeGooijer,4:30 that's great parenthood and an excellent rule for the rest of your life.,6년 전(수정됨),0,
@jimmygentile3354,Ask a CEO - you know they have the money.,6년 전(수정됨),0,
@mariajackson5829,"The only advise my grandparents gave me was to always have some cash saved away, and to never get a loan in my live.  Sometimes times may be hard but you stretch the money as much as you can most days to get by, and try to avoid the loans at all costs.",7년 전,0,
@marmiteman2196,"I need a dollar, dollar, dollar is what I need. Hey hey. I need a dollar, dollar, dollar is what I need",7년 전,0,
@timothygeiss01,"I totally understand. Payday rolls around, i pay all my bills (rent, electric, gas, water, cell phone,  car insurance, car payment) and I have just enough left to buy groceries and gas and then I'm out until next pay day only to repeat. Sometimes i have enough to by my kids a few toys and clothes but never for myself.",7년 전,0,
@pookoos,"I really feel for everyone in this doc. I've been impoverished and desperate myself (hitchhiking 26 miles to work every day, 36 cents in my bank account, dodging the landlord etc) It's pure misery that leaves you with something akin to post traumatic stress. However, I can't help but think that a teeny bit of honesty might be missing from this piece. It is true that the system is impersonal and merciless and downright Kafkaesque at times...but I also think it's very hard for most people to own up to the full folly of their choices.",7년 전,0,
@numbrs3254,!,7년 전,0,
@knpstrr,"Spending more than you make (whether bad luck of medical issues, or something else) results in a tough life, no doubt about it. Subjecting yourself to these fees on top of it all is just crazy. On top of that, wanting loans and credit isn't the solution either.  The ""rub"" in this film is that none of these people were forced to take on these loans, they chose to do so. What was their alternative? Bankruptcy? Negotiating payment plans? Charity? etc.",7년 전(수정됨),1,
@Lisa_MS64,The system is rigged.,8년 전,0,
@IvicaKolic,"That DEBIL logo is bugging me. It means MORON in Slaven languages, and WEAK in Spanish. She should change that first and maybe her company has a future.",8년 전,0,
@unpopularopinionmzansi8334,This documentary should have been called bad life decisions. It's quite sad the lengths that people have to go just to get by but there is also a problem with the way that all these people go about their financial decision making.,8년 전,2,
@lightbrightconnect,Dave Ramsey could help these folks.,8년 전,0,
@Cinepobrefilmfestival,get out of the USA before it's too expensive to breathe!,8년 전,0,
@Savalook,"I need to pay my bills ""electricity & the cable""",8년 전,0,
@lenamichiels9327,Feedback available assert roll champion race consciousness juror.,8년 전,0,
@aaronosenkarski7451,Young Turks are a joke!,8년 전,0,
@TJAzton,Everyone needs to watch this but I learned this when I was young because I relied on myself to learn how to use money instead of just listening to what everyone is saying.,8년 전,0,
@proudinfidel913,My teacher is making me watch a young turk video. This is where a Connecticut education as taken me.,8년 전,0,
@ninatravis7791,"I can tell you now, one way to cut down on power is to UNPLUG any and everything that is not being used. Lamps, toaster oven, microwave, TV's. It makes a difference. Even though these items are off, they are still using reserved power.",8년 전,0,
@alexanderstone4767,Complicated driver explore xtnffxn state ultimately sun.,8년 전,0,
@elguapo3811,"lesson learned: don't have children, live in an RV. when you don't have to pay rent you have a lot of money left over",9년 전,9,
@robinmariebesidethesea,Weird how this documentary is sponsored by American Express.,9년 전,2,
@NightExplorer96,Great documentary!,9년 전,1,
@hjjr-se5jv,"A lot to think about. How does a college education benefit if you have to spend most of your adult working life to pay off the debt. 40 years ago, you could get a part time job to pay for tuition and books at the local college. I graduated high school in Detroit Michigan in 1975. First semester 12 credit hours at wayne state university was 285.00...that same 12 credit hours today is 3400.00 and that does not include books and supplies. How do you justify the cost? The sad part is the cost is much higher if you don't go to college. What do you do if college is not an option...this is just only one example of debt vs life...",9년 전,22,
@systematic101,"With a neutral credit score I could cash a check up to $1000 immediately in my account.  Also, it should be mandatory that companies accept cash or if they choose to not take cash then it should be on them to cover the fees.  Seriously US. Student loans affect your credit score? In Canada your student loan has no impact on credit score. WTF!? in Canada no credit is considered good credit.  We should also be asking what did she take in college to rack up $100K in student loans. Having a college diploma is not what's important. What that diploma is for is what's important.  I would like to point out that if the middle class vanishes the economy will collapse and it will pull the rich with it. The economy is supported with the middle class.  What the woman with the car should have done is sell the car she had (could have gotten much more than $5K) and buy a very cheap car.",9년 전(수정됨),0,
@nneo100,"Wells Fargo bank offers checking accounts to customers that owe other banks. It is no monthly fee if you make ten purchases otherwise ten dollars a month. After a year, it becomes a regular checking account. Get an account payday; funds deposited available the same day. Use the free counter checks to your bills. Having a bank account saves a lot of money and time.",9년 전,0,
@michel.gonzalexleiva1152,So you can't sell anything on your spare time to make extra money come on...,9년 전,0,
@staytrue4201,"I had a bank try that 3x overdraft fee scam with me, I called and told them I refuse to pay- close the account and that was the end of that. comment reading fee, you owe me $1",9년 전,0,
@walkerhaw2056,oh come on why dont you people sell meth like walter white.your hardships are ushually your fault,9년 전,0,
@thisisrtsthree9992,"I love TYT so much, i know they are hated by far right wingers, anti black people, and so on, and i know many of their detractors in a few cases have logic to debate TYT, but yeah, keep the torch lit TYT, for the future.",9년 전,2,
@cattigereyes1,America is and has been a oligarchy! Yea!,9년 전,0,
@felsefeci,"Cenk, you're a chance to US. You're amazing.",9년 전,0,
@monicaram10,That was so sweet of their neighbors to help them ☺️,9년 전,4,
@faafafineartist,"The financial system is setup to fail and enslave the people. The people have to be fed up enough to DEMAND better. Until we do, we continue to allow the powers at be to continue stealing.",9년 전,16,
@LLYoutube565,Credit unions are so so so much easier to get a loan through. They have no money down on first time buyers of homes. Payday loans are awful.,9년 전,3,
@FongTactical,Bitcoin,9년 전,0,
@lindasabaj2687,Wasserstein fundraisers,9년 전,0,
@nusunsingleton5676,"When you are a part of a system that craps on you when you need them, and looks at you as nothing but profit or loss, why would you struggle so hard to return to that system.  The bank robbers now work at the banks, and our government allows these banks to extort, loan shark, and over charge customers.  It should outrage anyone in this situation that our government took our tax dollars to bail these banks out when they were finally about to reap what they have sewn.",9년 전,0,
@bonniegaither3994,Not exactly a viable option. And what about the here and now?,4년 전,1,
@Kali2Htwn,Very true we all think that going to college to obtain a degree will get us far in life but when debit kicks in life starts to get very real.,8년 전,1,
@vyoufinder,"My Mom worked at a movie theater all summer to pay for a year's worth of school and still had some leftover.  Rough eh?  Can you imagine working at a movie theater for 3 months and being able to not only pay your bills, but also head off to school for an entire year only working part time?  So ya, it's pretty easy to pull yourself up by your bootstraps if that's your situation I suppose.  My Dad worked for the forest service in the summers and made enough to pay for school, and also a brand new '65 Ford Mustang straight out of the showroom for $1200.  I wonder if things have changed?  Do students still works summers to pay for school all year and drive new sports cars with the extra?",3년 전(수정됨),0,
@MarinaDiamandis4Ever,They want you to fail but unfortunately some parents set their kids up to fail,9년 전,4,
@MotherOfTheNewMillenium,Not everyone has access to a credit union dummy!,9년 전,1,
@LLYoutube565,"KissOfDanger http://mapping.ncua.gov/ Just put in your zip code, find your closest credit union. Have a great day!",9년 전,5,
@demimal7987,"This resonates with me. My first business I made 1000% profit in the first year. My second business I made 7,400% in less than 6 months. Due to student loans never have enough money, time, or resources to go further. Someday though I won't give up!!",9년 전,1,
@imveryimportantandverypret2936,She didn't have too go to college to make leather bags,9년 전,1,
@syntaxed2,"Taxes are used to bail out corporations, thats the whole purpose of it. Your existance is slaving away for the corporate security state and thats that!",9년 전,19,
